kljuc;naziv
4751;Negativne teèajne razlike iz kreditnih obveza
4752;Negativne teèajne razlike iz potraživanja u inozemstvu
4753;Negativne teèajne razlike za ostalo (npr. iz blagajnièkog poslovanja, razlika izmeðu kupovnog i srednjeg teèaja banke i dr.)
4754;Negativne teèajne razlike nastale na stanjima deviznog raèuna i devizne blagajne
476;Gubitci iz ulaganja u dionice, udjele, obveznice i dr. vrijednosne papire (koji su prodani ispod troška nabave - èl. 10. ZoPD
477;Troškovi diskonta i nagodbi
4770;Troškovi diskonta pri prodaji potraživanja (faktoring)
4771;Troškovi iz financijskih nagodbi
4772;Ostali troškovi
478;Nerealizirani gubitci (rashodi) od financ. imovine
4780;Gubitci od smanjenja - vrijednosnog usklaðenja fin. imovine za trgovanje (MRS 39. t. 55a. i HSFI t. 9.22b)
4781;Troškovi smanjenja fin. imovine zbog ugovora o poteškoæama (HSFI t. 9.22a i MRS 39. t. 55b.)
4782;Gubitci od smanjenja vrijednosti ostale financ. imov.
479;Ostali financijski troškovi
4790;Rashodi s osnove valutne klauzule po obvezama i kreditima
4791;Rashodi s osnove usklaðenja obveza temeljem valutne i sl. klauzule (prema dobavljaèima, za predujmove i sl.)
4792;Troškovi valutne klauzule iz tražbina ili obveza
4793;Troškovi burzovnih usluga, emisije vrijednosnih papira i sl.
4794;Troškovi carine inozemnog financijskog i operativnog lizinga
4799;Ostali nespomenuti financijski troškovi
48;OSTALI POSLOVNI RASHODI
480;Trošak naknadnih popusta, sniženja, reklamacija i troškovi uzoraka
4800;Naknadno odobreni popusti i odobrenja
4801;Troškovi nagodbe (razlike iz sniženja)
4802;Troškovi nenadoknaðenih jamstava za prodana dobra
4803;Troškovi naknadnih reklamacija
4804;Troškovi uzoraka zbog kontrole i pregleda, izlaganje radi prodaje i sl.
481;Otpisi vrijednosno neusklaðenih potraživanja
4810;Otpisi nenaplaæenih jamstava i drugih osiguranja
4811;Izravni otpisi nenaplaæenih potraživanja od kupaca i drugih koja nisu vrijednosno usklaðena
4812;Troškovi ostalih otpisa
482;Rashodi - otpisi nematerijalne i materijalne imovine
4820;Neamortizirana vrijednost rashodovane, uništene ili otuðene dugotrajne imovine
4821;Otpisi imovine izvan uporabe - rashod
4822;Gubitak od prodane dug. imov. koja se ne amortizira
4823;Gubitak od prodaje ost. dug. mat. i nemat. imovine
4824;Otpisi materijala i robe - rashod
483;Manjkovi i provalne kraðe na zalihama i drugim sredstvima
4830;Manjkovi uslijed više sile (provalna kraða, elementarna nepogoda)
4831;Dopušteni manjkovi - kalo, rastep, kvar i lom na zalihama prema odlukama HGK, HOK ili internim aktima
4832;Prekomjerni manjkovi na zalihama (kalo, rastep, kvar i lom) iznad normativa + PDV, prema odlukama HGK, HOK ili interno - skrivene isplate (èl. 7., st. 5. ZoPD)
4833;Manjkovi novca i vrijednosnih papira
4839;Ostali manjkovi iz imovine
484;Kazne, penali, nadoknade šteta i troškovi iz ugovora
4840;Troškovi kazni za prijestupe i prekršaje i sl. (èl. 7., st. 1., t. 7. ZoPD)
4841;Troškovi prisilne naplate poreza i dr. davanja (èl. 7., st. 1., t. 6. ZoPD)
4842;Penali, ležarine, dangubnine
4843;Nadoknade šteta iz radnog odnosa (npr. za neiskorišteni godišnji odmor, zbog ozljede na radu, odštetne rente i sl.)
4844;Nadoknade štete drugim društvima, fizièkim osobama po nagodbama i sudskim presudama
4845;Ugovorene kazne i penali zbog neizvršenja, propusta i sl.
4846;Troškovi preuzetih obveza iz ugovora
4847;Kazne za parkiranje
4849;Ostali izdatci za štete
485;Naknadno utvrðeni troškovi poslovanja
4850;Naknadno utvrðeni troškovi - raèuni iz prethodnih godina
4851;Troškovi naknadnih razlika iz nabava
4852;Ispravak pogrešaka prethodnih razdoblja
486;Darovanje do 2% od ukupnog prihoda
4860;Darovanje za opæekorisne namjene (Darovi u novcu ili naravi do 2% od ukupnog prihoda prethodne godine za kulturu, znanost, odgoj i obrazovanje, zdravstvo, humanitarne, športske, vjerske, ekološke i dr. svrhe - èl. 7., st. 7. ZoPD)
4861;Darovanje za zdravstvene potrebe (darovanje vanjskih osoba do 2% od UP prethodne godine za operativne zahvate, lijeèenja, nabavu lijekova, ortopedskih pomagala i dr. što nije pokriveno osiguranjem - èl. 7., st. 8. ZoPD)
487;Darovanja iznad 2% od UP i dr. darovanja
4870;Porezno nepriznata darovanja iznad 2% UP (za svrhe iznad dopuštenih s raèuna 486) i darovanja inozemnih udruga, ustanova i sl. (èl. 7. st. 1. t. 10. ZoPD)
4871;Darovi (milodari), potpore i dotacije bez protuèinidbe primatelja, te dr. izdatci koji nisu u svezi s ostvarivanjem dobitka (+PDV, osim na novac - èl. 7., st. 1., t. 13. ZoPD)
4872;Darovanje politièkih stranaka i nezavisnih kandidata
488;Troškovi iz drugih aktivnosti (izvan osnovne djelatnosti)
4880;Troškovi iz ortaèkog ugovora
4881;Troškovi iz posredovanja
489;Ostali troškovi - rashodi (èl. 7. ZoPD)
4890;Rashodi utvrðeni u postupku nadzora (èl. 7. st. 1. t. 11. ZoPD) - skrivene isplate dobitka - izuzimanje dionièara èlanova društva i fizièkih osoba (obrtnika) i s njima povez. osobama
4891;Troškovi koji nisu izravno u svezi s ostvarivanjem dobitka (èl. 7., st. 1., t. 13. ZoPD - red. br. 24 PD, npr. amortiz. imov. koja ne služi obavljanju djelatnosti, dodjela vlastitih dionica - udjela i dr.) - porezno nepriznati
4892;Troškovi povalstica i dr. oblici imovinskih koristi (èl. 7., st.1. t.10. ZoPD) - porezno nepriznati
4899;Ostali nespomenuti poslovni rashodi
49;RASPORED TROŠKOVA
490;Raspored troškova za obraèun proizvoda i usluga (prema HSFI 10 i MRS-u 2 i MRS-u 11) - uskladištivi troškovi (na raèune 60, 62 i 63)
491;Raspored troškova za pokriæe upravnih, administrativnih, prodajnih i drugih troškova (na raèune 70 i 71)
6;PROIZVODNJA, GOTOVI PROIZVODI, ROBA I DUGOTRAJNA IMOVINA NAMIJENJENA PRODAJI
60;PROIZVODNJA - TROŠKOVI KONVERZIJE
600;Proizvodnja u tijeku (razrada po serijama, nositeljima troškova, mjestima, pogonima, gradilištima, objektima, radnim nalozima i sl.)
601;Vrijednost usluga (u tijeku ili nedovršenih na datum bilance - MRS 2, t. 16.)
602;Vanjska proizvodnja (kooperacija i dr.)
605;Proizvodnja u slobodnoj zoni
606;Proizvodnja u doradi i manipulaciji
607;Obustavljena proizvodnja
608;Proizvodnja u tijeku iz ortaèkog ugovora
609;Vrijednosno usklaðivanje proizvodnje - usluga
61;NEDOVRŠENI PROIZVODI I POLUPROIZVODI
610;Zalihe poluproizvoda (analitika prema osnovnim skupinama ili po stupnju dovršenosti)
611;Nedovršeni proizvodi i poluproizvodi (analitika po vrstama proizvoda)
619;Vrijednosno usklaðivanje nedovršenih proizvoda i poluproizvoda
62;BIOLOŠKA IMOVINA
620;Zalihe biološke proizvodnje u toku
621;Biloška imovina za prodaju
629;Vrijednosno usklaðivanje biloške imovine
63;ZALIHE GOTOVIH PROIZVODA
630;Gotovi proizvodi na skladištu (razrada za svako skladište a unutar toga po skupinama, tipovima, vrstama i sl.)
631;Gotovi proizvodi u javnom skladištu, silosu, i dr.
632;Gotovi proizvodi dani u komisijsku prodaju
633;Gotovi proizvodi dani u konsignacijsku prodaju
634;Gotovi proizvodi u doradi, obradi i manipulaciji
635;Gotovi proizvodi u slobodnoj zoni
636;Zalihe nekurentnih proizvoda i otpadaka
637;Gotovi proizvodi u izložbenim prostorima
638;Gotovi proizvodi iz ortaštava
639;Vrijednosno usklaðivanje zaliha gotovih proizvoda
64;GOTOVI PROIZVODI U VLASTITIM PRODAVAONICAMA
640;Gotovi proizvodi u prodaji u vlastitim prodavaonicama (analitika po prodavaonicama)
641;Uraèunani PDV u vrijednosti proizvoda
642;Uraèunani porez na luksuz
648;Uraèunana marža u prodajnoj cijeni gotovih proizvoda
649;Vrijednosno usklaðivanje gotovih proizvoda u prodavaonicama
65;OBRAÈUN TROŠKOVA NABAVE ROBE - TROŠKOVI KUPNJE
650;Kupovna cijena robe od dobavljaèa
651;Ostali troškovi nabave u svezi s dovoðenjem robe na zalihu
6510;Troškovi transporta
6511;Troškovi ukrcaja i iskrcaja (fakturirani)
6512;Transportno osiguranje
6513;Troškovi posebnog pakiranja - ambalaže
6514;Troškovi vlastitog transporta (ne više od tarife javnog prijevoza) dovoðenja robe na prodajnu lokaciju
6515;Troškovi oblikovanja za posebne kupce
6516;Troškovi èuvanja i rukovanja (u fazi nabave)
6517;Špediterski i bankarski troškovi
6518;Nadoknada uvozniku za uslugu uvoza
6519;Ostali troškovi kupnje (pregledi, atesti i dr. troškovi u svezi s dovoðenjem robe na zalihu - HSFI 10 i MRS 2)
652;Carina i druge uvozne pristojbe za robu
653;Posebni porezi (trošarine)
659;Obraèun nabave - trošak kupnje
66;ROBA
660;Roba u skladištu
6600;Roba u vlastitom veleprodajnom skladištu (analitika po skladištima)
6601;Zaliha otpadaka od robe
661;Roba u tuðem skladištu i izlozima
6610;Roba u tuðem skladištu
6611;Roba u tuðim silosima, hladnjaèama i sl.
6612;Roba u izložbenim prostorima
662;Roba dana u komisijsku ili konsignacijsku prodaju
663;Roba u prodavaonicama
6630;Roba u prodavaonici (po prodajnoj cijeni -analitika po prodavaonicama), ili
66300;Roba u prodavaonici A s PDV-om 23%
66301;Roba u prodavaonici A s PDV-om 10%
66302;Roba u prodavaonici A s PDV-om 0%, itd.
664;Uraèunani porezi u robi
6640;Uraèunani PDV (analitika po prodajnim mjestima i poreznim stopama)
6641;Uraèunani porez na luksuz
665;Roba u carinskom skladištu "D" ili u slobodnoj zoni
6650;Vlastita roba u carinskom skladištu tipa "D"
6651;Roba u slobodnoj zoni
666;Roba u doradi, obradi i manipulaciji
6660;Vrijednost robe u doradi
6661;Troškovi u svezi s doradom
667;Roba na putu
668;Uraèunana razlika u cijeni robe
6680;Razlika u cijeni robe na skladištu (analitièki po skupinama robe s istom maržom)
6681;Uraèunana marža robe u prodavaonici
669;Vrijednosno usklaðivanje zaliha robe
6690;Vrijednosno usklaðenje zbog pada cijena, smanjenja uporabljivosti i sl.
6691;Prepravljene cijene robe zbog monetarnih oscilacija
67;PREDUJMOVI ZA NABAVU ROBE
670;Dani predujmovi za nabavu robe
671;Dani predujmovi uvozniku za nabavu robe
672;Dani predujmovi za robu povezanom društvu
679;Vrijednosno usklaðenje danih predujmova za robu
68;NEKRETNINE I UMJETNINE ZA TRGOVANJE
680;Nabavna vrijednost nekretnina za preprodaju (s porezom na promet)
681;Troškovi dodatnog ureðenja - dorade
682;Umjetnine u prodaji
683;Nekretnine za prodaju (ureðene)
684;Uraèunani PDV u umjetnine
687;Predujmovi za kupnju nekretnina radi daljnje prodaje
688;Uraèunana razlika u cijeni nekretnina i umjetnina za daljnju prodaju
689;Vrijednosno usklaðivanje nekretnina i umjetnina u prometu i predujmova
69;DUGOTRAJNA IMOVINA NAMIJENJENA PRODAJI
690;Nematerijalna imovina namijenjena prodaji
691;Materijalna imovina namijenjena za prodaju
6910;Skupina imovine za prodaju (npr. pogon, poslov. jedinica i sl. )
699;Vrijednosno usklaðenje dugotrajne imovine namijenjena prodaji
7;POKRIÆE RASHODA I PRIHODI RAZDOBLJA
70;TROŠKOVI PRODANIH ZALIHA PROIZVODA I USLUGA
700;Trošak zaliha prodanih proizvoda (60, 62, 63 i 64)
701;Troškovi realiziranih usluga (490 i 601)
702;Troškovi neiskorištenog kapaciteta (HSFI t. 10.18. i MRS 2 t. 13)
703;Troškovi prodanih zaliha materijala i otpadaka (31, 32, 35 i 36)
7030;Troškovi nabavne vrijednosti materijala, dijelova, inventara i otpadaka
7031;Troškovi manjkova materijala, dijelova i inventara kojom se tereti odgovorna osoba
704;Rashodi zaliha proizvodnje (HSFI 10 i MRS 2)
7040;Dopušteni manjkovi - tehnološki kalo, rastep, kvar i lom i škart u proizvodnji (sa skupina 60, 62, 63 i 64) - porezno priznati
7041;Prekomjerni manjkovi - tehnološki kalo, rastep, kvar, lom i škart u proizvodnji (60, 62, 63 i 64 - HSFI t. 10.21. i MRS 2, t. 14.) a porezno dopušteni po oèevidu i sl. - porezno priznati
7042;Prekomjerni manjkovi proizvoda (HSFI t. 10.2. i MRS 2, t. 16.) - porezno nepriznati
7043;Razlika višeg troška proizvodnje od neto-vrijednosti koja se može realizirati (HSFI t. 10.35. i MRS 2, t. 28. do 33.)
7044;Troškovi isporuèenih proizvoda u jamstvenom roku (zamjena)
705;Greškom neiskazani rashodi proteklih razdoblja
706;Gubitci iz ugovora o izgradnj (MRS 11, t. 36.)
707;Troškovi iz ugovora o ortaštvu
708;Troškovi vrijednosnog usklaðenja proizvodnje u tijeku (609), poluproizvoda (629) i zaliha gotovih proizvoda (639 i 649)
71;TROŠKOVI PRODANE ROBE
710;Nabavna vrijednost prodane robe
7100;Trošak prodane robe u tuzemstvu
7101;Trošak prodane robe u inozemstvu
7102;Troškovi prodane robe u tranzitu
7103;Trošak prodane robe u poslov. jed.
711;Nabavna vrijednost prodanih nekretnina i umjetnina
712;Troškovi dugotr. imov. namijenjeni prodaji
713;Troškovi kala, rastepa, kvara i loma na robi i otpisi robe
7130;Kalo, rastep, kvar i lom u dopuštenoj visini prema Pravilniku HGK - porezno priznati
7131;Manjkovi uslijed više sile (provalne kraðe, poplava, požar, potres i sl.) - porezno priznati
7132;Manjkovi i otpisi trgovaèke robe po oèevidu PU i sl. - porezno priznati
7133;Prekomjerni kalo, rastep, kvar i lom + PDV - porezno nepriznati
7134;Manjak robe na teret odgovorne osobe
714;Troškovi zamjene robe u jamstvenom roku
715;Greškom neiskazani rashodi prodane robe u proteklim razdobljima u trgovini
718;Troškovi vrijednosnog usklaðenja trgovaèke robe i predujmova (669, 679, 689)
719;Troškovi vrijednosnog usklaðenja dugotrajne imovine namijenjene prodaji (699)
72;TROŠKOVI ADMINISTRACIJE I OSTALI RASHODI
720;Troškovi uprave, prodaje, administracije (491)
721;Ostali poslovni rashodi - nespomenuti
73;IZVANREDNI - OSTALI RASHODI
730;Izvanredni rashodi od prodaje dugotrajne imovine (HSFI t. 8.35.)
731;Izvanredni otpisi od otuðenja imovine koji su nastali neoèekivano i u visokoj vrijednosti (HSFI t. 4.7. i MRS 10. t. 9.)
732;Gubitci zbog izvlaštenja ili zbog prirodnih katastrofa na važnom dijelu imovine
733;Izvanredni rashodi iz ostalih rijetkih i neobiènih dogaðaja ili transakcija
734;Izvanredne kazne, penali, odštete, naknadno utvrð. obveze i sl.
735;Nerealizirani gubitci
737;Gubitci od procjene biološke imovine
74;UDIO U GUBITKU I DOBITKU PRIDRUŽENIH PODUZETNIKA
740;Udio u gubitku pridruženih poduzetnika
7400;Udio u gubitku povezanih društava
7401;Udio u gubitku ortaka
745;Udio u dobitku od pridruženih poduzetnika
7450;Udio u dobitku povezanih društava
7451;Udio u dobitku ortaštva
75;PRIHODI OD PRODAJE PROIZVODA I USLUGA
750;Prihodi od prodaje proizvoda (analitika po proizvodima ili profitnim centrima)
7500;Prihodi od prodaje proizvoda od redovne prodaje
7501;Prihodi od prodaje proizvoda na kredit ili otplatu
7502;Prihodi ostvareni u slobodnoj zoni
7503;Prodaja u vlastitim prodavaonicama
7504;Prihodi od prodaje stanova i dr. graðevina
7505;Prihodi od prodaje poluproizvoda i nedovršenih proizvoda
7506;Prihodi ostvareni u posl. jed. na podruèju posebne držav. skrbi i u Vukovaru
7507;Prihod od povratne naknade za ambalažu (bez PDV-a)
7508;Prihod od prodaje otpadaka iz proizvodnje
7509;Prihodi od prodaje poluproizvoda i nedovršenih proizvoda
751;Prihodi od prodaje usluga
7510;Prihodi od servisnih usluga, usluga popravaka i sl. usluga
7511;Prihodi od restorana i gostionica
7512;Prihodi od hotela i noæenja
7513;Prihodi od knjigovodstvenih, usluga poreznog savjetovanja, revizorskih, konzultantskih i dr. usluga
7514;Prihodi od usluga prijevoza
7515;Prihodi od komunalnih usluga
7516;Prihodi od promidžbenih usluga
7517;Prihodi od usluga zaštite i istraživanja
7518;Prihodi od programskih usluga
7519;Prihodi od prodaje ostalih usluga
752;Prihodi od graditeljskih usluga - iz ugovora o izgradnji (graðevina, postrojenja, brodova i sl.)
753;Prihodi od prodaje dobara u inozemstvo (moguæa analitika po vrstama proizvoda i zemljama)
754;Prihodi od prodaje usluga u inozemstvo (moguæa analitika po vrstama usluga i zemljama kupcima)
7540;Prihodi iz meðunarodne plovidbe brodovima (èl. 26., st. 10. ZoPD)
7541;Prihodi od internetskih usluga za inozemstvo
7542;Prihodi od poslovnih jedinica u inozemstvu
7543;Prihodi od prodaje turistièkih usluga u inozem.
755;Prihodi od prodaje proizvoda i usluga poduzetnicima u kojima postoje sudjelujuæi interesi (do 20% udjela)
756;Prihodi od prodaje proizvoda i usluga ovisnim društvima (analitika po društvima)
757;Prihodi od najmova i zakupa
758;Prihodi iz ortaštva
759;Ostali prihodi od prodaje uèinaka
76;PRIHODI OD PRODAJE TRGOVAÈKE ROBE
760;Prihodi od prodaje robe
7600;Prihodi od prodaje robe na veliko (analitika po prodajnim mjestima)
7601;Prihodi od prodaje uvezene robe na veliko
7602;Prihodi od prodaje robe u tranzitu
7603;Prihodi od prodaje robe na malo (analitika po prodav.)
7604;Prihodi od prodaje robe u povezanim društvima
7605;Prihodi od prodaje robe dane u komisiju ili konsignaciju
7606;Prihodi od prodaje u poslov. jed. na podruèju posebne držav. skrbi i Vukovaru
7607;Prihodi od povratne naknade za ambalažu (bez PDV-a)
7608;Prihodi od prometa nekretnina
761;Prihodi od prodaje robe na inozemnom tržištu
762;Prihodi od trgovaèkih usluga
7620;Prihodi od provizija
7621;Prihodi od franšiza i robnih znakova
7622;Prihodi od usluge posredovanja
7623;Prihodi od davanja mišljenja
763;Prihodi od prodaje nekurentne robe (robe u kvaru, ošte-æenju, demodirana i sl.)
764;Prihodi od prodaje robe na kredit
7640;Prihodi od prodaje robe na robni kredit
7641;Prihodi od prodaje robe na potrošaèki kredit
765;Prihodi od prodaje robe poduzetnicima u kojima postoje sudjelujuæi interesi (do 20% udjela)
766;Prihodi od prodaje robe ovisnim društvima
767;Prihodi od dane (prodane) robe u financijski lizing (najam)
768;Prihodi od preprodaje nekretnina i umjetnina
769;Ostali prihodi od prodaje roba i trgovaèkih usluga
7690;Prihodi od prikupljanja ambalaže
7691;Prihodi od zbrinjavanja otpada
7692;Prihodi od prodaje korisnog otpada
77;FINANCIJSKI PRIHODI
770;Kamate, teèajne razlike, dividende i sl. prihodi iz odnosa s povezanim poduzetnicima
7700;Prihodi od kamata od povezanih poduzetnika
7701;Prihodi od teèajnih razlika od povez. poduzet.
7702;Prihodi od dividende (dobitka) iz udjela u povezanim poduzetnicima
7703;Prihodi od valutne (indeksne) klauzule iz odnosa s povezanim poduzetnicima
7704;Ostali financijski prihodi od povezanih poduzet
7705;Ostali financijski prihodi od povez. poduzetnika
7706;Dobitci od prodaje udjela i dionica od povezanih poduzetnika
771;Prihodi od kamata
7710;Prihodi od redovnih kamata
7711;Prihodi od zateznih kamata
7712;Prihodi od kamata iz financijske imovine i dr.
7713;Kamate na depozite i jamèevine
772;Prihodi od teèajnih razlika
7720;Pozitivne teèajne razlike iz tražbina i stanja deviza na raèunu
7721;Pozitivne teèajne razlike iz nižih obveza prema inozemstvu
7722;Prihodi od ostalih teèajnih razlika
773;Prihodi od dividende i dobitaka iz udjela
7730;Prihodi od dividendi
7731;Prihodi od udjela u dobitku u d.o.o. i dr.
774;Ostali financijski prihodi
7740;Prihodi iz udjela u investicijskim i dr. fondovima
7741;Dobitci od prodaje dionica i udjela (s nepovez. društvima) i dr. vrijed. papira
7742;Prihodi od primjene valutne (indeksne) klauzule
7743;Ostali financijski prihodi iz odnosa s nepovezanim poduzetnicima i dr. osobama
7744;Prihodi od prodaje ostale financijske imovine
775;Dio prihoda od pridruženih poduzetnika i sudjelujuæih interesa
7750;Financijski prihodi (dividende, dobitci) iz udjela u društvima do 20%
7751;Prihodi od kamata, teèajnih razlika i dr. fin. prihoda iz odnosa s pridruženim poduzetnicima i od društava u kojima se drži udio do 20%
776;Nerealizirani dobitci (prihodi) od financijske imovine
7760;Prihodi iz procjene fin. imovine namijenjene za trgovanje (HSFI 15. t. 15.52. i MRS 39. t. 55a. i dr.)
7761;Dobitci iz promjene fer vrijednosti ulaganja u nekretnine (HSFI 7. i MRS 40)
7762;Dobitci iz promjene vrijednosti ostale imovine
777;Prihodi negativnog goodwilla
778;Ostali financijski prihodi
7780;Prihodi iz burzovnih transakcija
7781;Prihodi iz faktoringa i sl.
7782;Prihodi od neplaæenih obveza - davanja (za šume, poreze, èlanarine, naknade i dr.)
7783;Prihodi iz fin. leasinga
7784;Prihodi od naplate životnog osiguranja
78;OSTALI POSLOVNI I IZVANREDNI PRIHODI
780;Prihodi od otpisa obveza i popusta
7800;Otpisi obveza prema dobavljaèima, obveza za primljene predujmove i sl.
7801;Otpis obveza prema kreditorima
7802;Otpis obveza prema zaposlenicima
7803;Prihodi od zastare obveza
7805;Otpis ostalih obveza
7807;Prihodi od naknadnih odobrenja - sniženja i popusta od dobavljaèa i dr.
781;Prihodi od rezidualnih imovinskih stavki, viškova i procjena
7810;Prihodi od prodaje otpisanih i rashodovanih sredstava rada (alata, opreme i sl.)
7811;Prihodi od prodaje dugotrajne materijalne imovine (iz uporabe)
7812;Prihodi od prodaje dugotr. nemater. imovine (trgov. znak, patent i dr.) - iz uporabe
7813;Prihodi od ranije otpisanih zaliha po novoj procjeni (HSFI t. 10.38. i MRS 2, t. 33.)
7814;Inventurni viškovi na robi, proizvodima i zalihama sirovina, materijala, dijelova i dugotrajne imovine
7815;Viškovi u blagajni (novac, vrijed. papiri i dr.)
7816;Viškovi iz neidentificiranih novèanih doznaka u tekuæem poslovanju
7817;Prihodi od prodaje viškova zaliha i dr. kratkotrajne i dugotrajne imovine
7818;Prihodi od procjene prometa (utrška) po nalazu poreznog nadzora
7819;Prihodi od ostalih primitaka bez nadoknade
782;Prihodi od ukidanja rezerviranja i naknadno naplaæeni prihodi
7820;Prihodovanje dugoroènih rezerviranja
7821;Naknadno utvrðeni prihodi
7822;Ukidanje pasiv. vrem. razgranièenja
7824;Prihodi od ukidanja troškova od kojih se odustalo
7825;Prihodi od naknadno naplaæenih jamstava - garancija
7826;Prihodi od naknadno naplaæenih potraživanja iz prethodnih godina
7827;Prihodi od naplate iz ugovora po naknadnim priznanjima iz prošlih godina
7828;Prihodi od naknadno naplaæenih reklamacija
7829;Prihodi od zaprimanja dobara koja su prodana u prethodnom obraè. razdoblju
783;Prihodi od refundac., dotacija, subvencija i nadoknada
7830;Prihodi od refundacije za rad radnika
7831;Prihodi od naknada šteta iz tekuæeg poslovanja
7832;Prihodi od subvencija
7833;Prihodi od dotacija i pomoæi
7834;Prihodi s osnove basplatnog primitka opreme, nekretnina, zaliha i potraživanja
7835;Prihodi od naknada za jamstva
7836;Prihodi od prefakturiranih troškova (npr. komunalnih, premija osiguranja i dr.)
7837;Prihodi za pokriæe gubitka
7838;Prihodi za manjkove od odgovornih osoba
7839;Prihodi od ostalih nadoknada iz poslovanja
784;Prihodi od revalorizacije - procjene
7840;Prihodi od revalorizacije
7841;Prihodi od revalorizacije s temelja vrijednosnog usklaðenja
7842;Prihodi od ukidanja gubitka (MRS 36)
7843;Prihodi od procjene zaliha i dr. imovine
7844;Prihodi od procjene ostale imovine
785;Ostali poslovni prihodi
7850;Prihodi s osnove povrata poreza na promet
7851;Prihodi od ugovorenih i naplaæenih penala zbog neizvršenja roka u isporuci
7852;Prihodi od nagrada za proizvod, uslugu, oblik i sl.
7853;Prihodi od (nevraæenih) kaucija i depozita
7854;Prihodi od kapara, odustatnina i sl.
7855;Prihodi od vraæenih premija osiguranja
7856;Prihodi od financijskog inženjeringa (npr. projektiranje, financiranje i izgr. objekata, kupnja i prodaja poduzeæa i sl.) i provizija
7857;Prihodi od prodaje prava (patenata, licencija, koncesija, rente, imena, znaka i sl.)
7858;Prihodi od naplate šteta uništene imovine (požarom, poplavom i dr. višom silom)
7859;Prihodi od naplate šteta po sudskim procesima (npr. zbog oduzete imovine, zlouporabe znaka, imena, prava i dr.)
786;Prihodi od državnih potpora (HSFI 15 i MRS 20)
7860;Prihodi od državnih potpora za pokriæe troškova
7861;Prihodi od državnih potpora za investicije (sredstva)
7862;Prihodi od državnih potpora za ostale odreðene namjene
787;Dobitci od procjene poljoprivrednih proizvoda i biološke imovine (HSFI, 17. t. 17.12 i MRS 41)
7870;Dobitci od prirasta biološke imovine
7871;Dobitci od procjene biološke imovine
7872;Dobitci od procjene poljoprivrednih proizvoda
788;Prihodi od izvanredne prodaje znaèajnog dijela imovine (zgrade, pogona, zemljišta)
7880;Prihodi od dugotr. materijalne imovine namijenjene prodaji
789;Izvanredni - nepredviðeni prihodi (npr. veliki besplatni primitak, prihod koji nije proizašao iz redovitog poslovanja)
7890;Prihod od izvansudskih nagodbi
7899;Ostali nepredviðeni prihodi
79;RAZLIKA PRIHODA I RASHODA FINANCIJSKE GODINE
790;Razlika prihoda i rashoda (iz cjelokupnog poslovanja)
8;FINANCIJSKI REZULTAT POSLOVANJA I OSTALI SVEOBUHVATNI DOBITAK
80;DOBITAK ILI GUBITAK RAZDOBLJA
800;Dobitak prije oporezivanja
801;Gubitak prije oporezivanja
803;Porez na dobitak (gubitak)
804;Dobitak ili gubitak razdoblja
8040;Dobitak razdoblja (poslije poreza)
8041;Gubitak razdoblja
81;DOBITAK ILI GUBITAK RAZDOBLJA KOJI PRIPADA DRUGIMA
810;Dobitak pripisan imateljima kapitala matice
811;Gubitak koji tereti imatelje kapitala matice
813;Dobitak pripisan manjinskom interesu
814;Gubitak koji tereti manjinski interes
88;OSTALI SVEOBUHVATNI DOBITAK
880;Teèajne razlike iz preraèuna inozemnog poslovanja
881;Promjene revalorizacijskih rezervi dugotrajen materijalne i nematerijalne imovine
882;Dobitak ili gubitak s osnove ponovnog vrednovanja financijske imovine raspoložive za prodaju
883;Dobitak ili gubitak s osnove uèinkovite zaštite novèanog toka
884;Dobitak ili gubitak s osnove uèinkovite zaštite neto ulaganja u inozemstvu
885;Udio u ostalom sveobuhvatnom dobitku/gubitku pridruženih poduzetnika
886;Aktuarski dobitci/gubitci po planovima definiranih primanja
887;Porez na ostali sveobuhvatni dobitak razdoblja
89;OSTALI ÈISTI DOBITAK
890;Neto ostali sveobuhvatni dobitak/gubitak razdoblja
891;Sveobuhvatni dobitak/gubitak razdoblja
892;Sveobuhvatna dobitak ili gubitak razdoblja
8920;Pripisan imateljima kapitala matice
8921;Pripisan manjinskom interesu
9;KAPITAL I PRIÈUVE TE IZVANBILANÈNI ZAPISI
