"code","name","note"
"1370","Potraživanja za isporučena dobra i usluge","Potraživanja za isporučena dobra i usluge"
"1371","Potraživanja za doznake novca, za dobitak i dr.","Potraživanja za doznake novca, za dobitak i dr."
"138","Ostala poslovna potraživanja","Ostala poslovna potraživanja"
"1380","Potraživanja za naknadne popuste","Potraživanja za naknadne popuste"
"1381","Potraživanja od ortaka","Potraživanja od ortaka"
"1382","Potraživanja od zastupnika","Potraživanja od zastupnika"
"1389","Ostala poslovna potraživanja","Ostala poslovna potraživanja"
"139","Vrijednosno usklađenje potraživanja od zaposlenih članova društva i ostalih potraživanja","Vrijednosno usklađenje potraživanja od zaposlenih članova društva i ostalih potraživanja"
"14","POTRAŽIVANJA OD DRŽAVE ZA POREZE, CARINU I DOPRINOSE","POTRAŽIVANJA OD DRŽAVE ZA POREZE, CARINU I DOPRINOSE"
"140","Porez na dodanu vrijednost","Porez na dodanu vrijednost"
"1400","Pretporez po ulaznim računima","Pretporez po ulaznim računima"
"14000","Pretporez - 10%","Pretporez - 10%"
"14001","Pretporez - 22%","Pretporez - 22%"
"14002","Pretporez - 23%","Pretporez - 23%"
"1401","Pretporez iz predujmova","Pretporez iz predujmova"
"14010","Pretporez iz predujmova -10%","Pretporez iz predujmova -10%"
"14011","Pretporez iz predujmova - 22%","Pretporez iz predujmova - 22%"
"14012","Pretporez iz predujmova - 23%","Pretporez iz predujmova - 23%"
"1402","Plaćeni PDV pri uvozu dobara","Plaćeni PDV pri uvozu dobara"
"14020","Plaćeni PDV pri uvozu dobara - 10%","Plaćeni PDV pri uvozu dobara - 10%"
"14021","Plaćeni PDV pri uvozu dobara - 22%","Plaćeni PDV pri uvozu dobara - 22%"
"14022","Plaćeni PDV pri uvozu dobara - 23%","Plaćeni PDV pri uvozu dobara - 23%"
"1403","Plaćeni PDV na usluge inozemnih poduzetnika","Plaćeni PDV na usluge inozemnih poduzetnika"
"14030","Plaćeni PDV na usluge inozemnih poduzetnika - 10%","Plaćeni PDV na usluge inozemnih poduzetnika - 10%"
"14031","Plaćeni PDV na usluge inozemnih poduzetnika - 22%","Plaćeni PDV na usluge inozemnih poduzetnika - 22%"
"14032","Plaćeni PDV na usluge inozemnih poduzetnika - 23%","Plaćeni PDV na usluge inozemnih poduzetnika - 23%"
"1404","Ispravci pretporeza zbog prenamjene dobara","Ispravci pretporeza zbog prenamjene dobara"
"14040","Ispravak pretporeza zbog promjene postotka priznavanja PDV-a","Ispravak pretporeza zbog promjene postotka priznavanja PDV-a"
"1406","Pretporez stečen po ugovoru o asignaciji ili iz preknjižavanja","Pretporez stečen po ugovoru o asignaciji ili iz preknjižavanja"
"1407","Potraživanja za razliku većeg pretporeza od obveze u obračunskom razdoblju","Potraživanja za razliku većeg pretporeza od obveze u obračunskom razdoblju"
"1408","Pretporez koji još nije priznan (uključivo i neplaćeni R-2)","Pretporez koji još nije priznan (uključivo i neplaćeni R-2)"
"1409","Potraživanja za više plaćeni PDV po konačnom obračunu","Potraživanja za više plaćeni PDV po konačnom obračunu"
"141","Potraživanja za porez i prirez na dohodak iz plaća i drugih primanja","Potraživanja za porez i prirez na dohodak iz plaća i drugih primanja"
"1410","Potraživanja za porez na dohodak iz plaća","Potraživanja za porez na dohodak iz plaća"
"1411","Potraživanja za prirez iz plaća","Potraživanja za prirez iz plaća"
"1412","Potraživanja za porez na dohodak iz autorskih prava, ugovora o djelu, članova nadz. odbora i dr.doh.","Potraživanja za porez na dohodak iz autorskih prava, ugovora o djelu, dohodaka članova nadzornog odbora i drugih dohodaka"
"1413","Potraživanja za porez i prirez na stipendije i nagrade učenika i studenta","Potraživanja za porez i prirez na stipendije i nagrade učenika i studenta"
"1414","Potraživanja za poreze iz drugih dohodaka","Potraživanja za poreze iz drugih dohodaka"
"1417","Potraživanja za više plaćeni porez na dohodak od kapitala","Potraživanja za više plaćeni porez na dohodak od kapitala"
"142","Potraživanja za više plaćene doprinose iz plaća i na plaće","Potraživanja za više plaćene doprinose iz plaća i na plaće"
"1420","Potraživanja za više plaćene doprinose za MO iz plaće","Potraživanja za više plaćene doprinose za MO iz plaće"
"1421","Potraživanja od MO za više plaćeni doprinos za beneficirani staž","Potraživanja od MO za više plaćeni doprinos za beneficirani staž"
"1422","Potraživanja za više plaćeni doprinos za zdravstveno osiguranje na plaće","Potraživanja za više plaćeni doprinos za zdravstveno osiguranje na plaće"
"1423","Potraživanja za više plaćeni dopr. za zdrav. osigur. za slučaj ozljede na radu i prof. bolesti","Potraživanja za više plaćeni dopr. za zdrav. osigur. za slučaj ozljede na radu i prof. bolesti"
"1424","Potraživanja za više plaćeni doprinos za zapošljavanje na plaće","Potraživanja za više plaćeni doprinos za zapošljavanje na plaće"
"1429","Potraživanja za ostale nespomenute doprinose","Potraživanja za ostale nespomenute doprinose"
"143","Potraživanja za porez na dobitak i po odbitku","Potraživanja za porez na dobitak i po odbitku"
"1430","Potraživanja za plaćene predujmove poreza na dobitak","Potraživanja za plaćene predujmove poreza na dobitak"
"1432","Potraživanja za više plaćeni porez po odbitku (na inozemne usluge)","Potraživanja za više plaćeni porez po odbitku (na inozemne usluge)"
"1433","Potraživanja za porez na dobitak stečen po ugovoru o cesiji ili iz preknjižavanja","Potraživanja za porez na dobitak stečen po ugovoru o cesiji ili iz preknjižavanja"
"1434","Porez na dobitak plaćen u inozemstvu","Porez na dobitak plaćen u inozemstvu"
"144","Potraživanja za posebne poreze (akcize - trošarine) i dr. poreze od države","Potraživanja za posebne poreze (akcize - trošarine) i dr. poreze od države"
"1440","Potraživanja za poseban porez na kavu","Potraživanja za poseban porez na kavu"
"1441","Potraživanja za poseban porez na bezalkoholna pića","Potraživanja za poseban porez na bezalkoholna pića"
"1442","Potraživanja za poseban porez na alkoholna pića","Potraživanja za poseban porez na alkoholna pića"
"1443","Potraživanja za poseban porez na pivo","Potraživanja za poseban porez na pivo"
"1444","Potraživanja za poseban porez na duhanske proizvode","Potraživanja za poseban porez na duhanske proizvode"
"1445","Potraživanja za poseban porez na naftne derivate i naknade za ceste","Potraživanja za poseban porez na naftne derivate i naknade za ceste"
"1446","Potraživanja za poseban porez na osobne automobile, motocikle, ostala mot. vozila, plovila i zrakop.","Potraživanja za poseban porez na osobne automobile, motocikle, ostala motorna vozila, plovila i zrakoplove"
"1447","Potraživanja za poseban porez na luksuzne proizvode","Potraživanja za poseban porez na luksuzne proizvode"
"1448","Potraživanja za porez na promet nekretnina","Potraživanja za porez na promet nekretnina"
"1449","Potraživanja za 5% poreza na promet motornih vozila i plovila","Potraživanja za 5% poreza na promet motornih vozila i plovila"
"145","Potraživanja za plaćenu članarinu turističkim zajed.","Potraživanja za plaćenu članarinu turističkim zajed."
"146","Potraživanja za članarine komori (HGK ili HOK)","Potraživanja za članarine komori (HGK ili HOK)"
"147","Potraživanja za carinu i više plaćene carinske pristojbe","Potraživanja za carinu i više plaćene carinske pristojbe"
"148","Potraživanja za županijski i općinski (gradski) porez","Potraživanja za županijski i općinski (gradski) porez"
"1480","Potraživanja za više plaćeni porez na motorna vozila i plovne objekte","Potraživanja za više plaćeni porez na motorna vozila i plovne objekte"
"1481","Potraživanja za porez na kuće za odmor i korištenje javnih površina","Potraživanja za porez na kuće za odmor i korištenje javnih površina"
"1482","Potraživanja za porez na reklamu","Potraživanja za porez na reklamu"
"1483","Potraživanja za porez na tvrtku ili naziv","Potraživanja za porez na tvrtku ili naziv"
"1484","Potraživanja za porez na potrošnju u ugostiteljstvu","Potraživanja za porez na potrošnju u ugostiteljstvu"
"1485","Potraživanja za plaćeni porez na priređivanje zabavnih i športskih priredbi","Potraživanja za plaćeni porez na priređivanje zabavnih i športskih priredbi"
"1486","Potraživanja za plaćeni porez na nasljedstva i darove","Potraživanja za plaćeni porez na nasljedstva i darove"
"1487","Potraživanja za više plaćeni porez na neiskorištene nekretnine","Potraživanja za više plaćeni porez na neiskorištene nekretnine"
"1489","Potraživanja za ostale poreze županije (grada), općine","Potraživanja za ostale poreze županije (grada), općine"
"149","Potraživanja za ostale nespomenute poreze, doprinose, takse i pristojbe","Potraživanja za ostale nespomenute poreze, doprinose, takse i pristojbe"
"1490","Potraživanja za više plaćenu nadoknadu za šume","Potraživanja za više plaćenu nadoknadu za šume"
"1491","Potraživanja za više plaćene kazne i sl.","Potraživanja za više plaćene kazne i sl."
"1492","Potraživanja za više uplaćene naknade za iskorištavanje mineralnih sirovina","Potraživanja za više uplaćene naknade za iskorištavanje mineralnih sirovina"
"1493","Potraživanja za više plaćene naknade za koncesije","Potraživanja za više plaćene naknade za koncesije"
"1495","Potraživanja za spomeničku rentu","Potraživanja za spomeničku rentu"
"1497","Potraživanje od Fonda za razvoj i sl.","Potraživanje od Fonda za razvoj i sl."
"1499","Potraživanja za ostala plaćena davanja državi i državnim institucijama","Potraživanja za ostala plaćena davanja državi i državnim institucijama"
"15","POTRAŽIVANJA OD DRŽAVNIH INSTITUCIJA","POTRAŽIVANJA OD DRŽAVNIH INSTITUCIJA"
"150","Potraživanje za nadoknade bolovanja od HZZO","Potraživanje za nadoknade bolovanja od HZZO"
"151","Potraživanja od mirovinskog osiguranja","Potraživanja od mirovinskog osiguranja"
"152","Potraživanja od lokalne samouprave","Potraživanja od lokalne samouprave"
"153","Potraživ. za regrese, premije, stimulac. i držav. potpore","Potraživ. za regrese, premije, stimulac. i držav. potpore"
"154","Potraživanje od Fonda za otkupljenu ambalažu","Potraživanje od Fonda za otkupljenu ambalažu"
"155","Ostala potraživanja od državnih institucija","Ostala potraživanja od državnih institucija"
"159","Vrijednosno usklađenje potraživanja od države i drugih institucija","Vrijednosno usklađenje potraživanja od države i drugih institucija"
"19","PLAĆENI TROŠKOVI BUDUĆEG RAZDOBLJA I OBRAČUNANI PRIHODI (unutar jedne godine od datuma bilance)","PLAĆENI TROŠKOVI BUDUĆEG RAZDOBLJA I OBRAČUNANI PRIHODI (unutar jedne godine od datuma bilance)"
"190","Unaprijed plaćeni troškovi","Unaprijed plaćeni troškovi"
"1900","Unaprijed plaćeni troškovi održavanja, opreme, postrojenja i građevina","Unaprijed plaćeni troškovi održavanja, opreme, postrojenja i građevina"
"1901","Unaprijed plaćena zakupnina iz operativnog - poslovnog najma","Unaprijed plaćena zakupnina iz operativnog - poslovnog najma"
"1902","Unaprijed plaćeni troškovi reklame, propagande i sajmova","Unaprijed plaćeni troškovi reklame, propagande i sajmova"
"1903","Unaprijed plaćeni troškovi energije za sljedeće razdoblje","Unaprijed plaćeni troškovi energije za sljedeće razdoblje"
"1904","Unaprijed plaćeni troškovi osig. imovine i osoba na opasnim poslovima ili putnika u prometu i sl.","Unaprijed plaćeni troškovi osiguranja imovine i osoba koje rade na opasnim poslovima ili putnika u prometu i sl."
"1905","Unaprijed plaćene kamate na bankovna jamstava i sl.","Unaprijed plaćene kamate na bankovna jamstava i sl."
"1906","Unaprijed plaćeni troškovi reprezentacije","Unaprijed plaćeni troškovi reprezentacije"
"1907","Unaprijed plaćene pretplate na službena glasila i stručne časopise","Unaprijed plaćene pretplate na službena glasila i stručne časopise"
"1908","Unaprijed isplaćene plaće za buduće razdoblje","Unaprijed isplaćene plaće za buduće razdoblje"
"1909","Unaprijed plaćeni ostali troškovi posl.(prijevoza, bank. usluge, zdr. zaštita,autorski,rad po ug. i sl)","Unaprijed plaćeni ostali troškovi poslovanja (troškovi prijevoza, bankovne usluge, zdravstvena zaštita, autorski honorari, rad po ugovoru i sl.)"
"191","Obračunani prihodi (budućeg razdoblja)","Obračunani prihodi (budućeg razdoblja)"
"192","Unaprijed plaćeni ovisni troškovi nabave (koji nisu na 651)","Unaprijed plaćeni ovisni troškovi nabave (koji nisu na 651)"
"193","Troškovi kamata iz budućeg razdoblja","Troškovi kamata iz budućeg razdoblja"
"194","Unaprijed plaćeni troškovi koncesija (za razdoblje do 12 mj.)","Unaprijed plaćeni troškovi koncesija (za razdoblje do 12 mj.)"
"195","Unaprijed plaćene franšize, trgovačko znakovlje, prava i sl. (do 12 mj.)","Unaprijed plaćene franšize, trgovačko znakovlje, prava i sl. (do 12 mj.)"
"196","Unaprijed plaćene licencije i patenti (do 12 mj.)","Unaprijed plaćene licencije i patenti (do 12 mj.)"
"199","Ostali plaćeni troškovi budućeg razdoblja","Ostali plaćeni troškovi budućeg razdoblja"
"1999","Ostala aktivna vremenska razgraničenja","Ostala aktivna vremenska razgraničenja"
"2","KRATKOROČNE I DUGOROČNE OBVEZE, DUGOROČNA REZERVIRANJA, ODGOĐENA PLAĆANJA I PRIHODI BUDUĆEG RAZDOBLJA","KRATKOROČNE I DUGOROČNE OBVEZE, DUGOROČNA REZERVIRANJA, ODGOĐENA PLAĆANJA I PRIHODI BUDUĆEG RAZDOBLJA"
"20","KRATKOROČNE OBVEZE PREMA POVEZANIM PODUZETNICIMA I S OSNOVE UDJELA U REZULTATU (do jedne godine)","KRATKOROČNE OBVEZE PREMA POVEZANIM PODUZETNICIMA I S OSNOVE UDJELA U REZULTATU (do jedne godine)"
"200","Obveze prema povezanim poduzetnicima","Obveze prema povezanim poduzetnicima"
"2000","Obveze prema povezanim društvima za preuzete zalihe (poluproizvoda, robe i sl.)","Obveze prema povezanim društvima za preuzete zalihe (poluproizvoda, robe i sl.)"
"2001","Obveze za raspoređeni dobitak iz poslovanja prema povezanim društvima","Obveze za raspoređeni dobitak iz poslovanja prema povezanim društvima"
"2002","Obveze za zajmove prema povezanim društvima","Obveze za zajmove prema povezanim društvima"
"2003","Obveze prema podružnicama","Obveze prema podružnicama"
"2004","Obveze prema osnovanim ustanovama, zadrugama i sl.","Obveze prema osnovanim ustanovama, zadrugama i sl."
"2005","Obveze za predujmove od povezanih društvima","Obveze za predujmove od povezanih društvima"
"2008","Obveze za kamate prema povezanim društvima","Obveze za kamate prema povezanim društvima"
"2009","Ostale kratkoročne obveze prema povezanim društvima","Ostale kratkoročne obveze prema povezanim društvima"
"201","Obveze s osnove udjela u rezultatu","Obveze s osnove udjela u rezultatu"
"2010","Obveze s osnove udjela u dobitku (analitika prema članovima)","Obveze s osnove udjela u dobitku (analitika prema članovima)"
"2011","Obveze za dividende dioničarima","Obveze za dividende dioničarima"
"2012","Obveze za sudjelujuće dobitke u rezultatu iz zajedničkog pothvata","Obveze za sudjelujuće dobitke u rezultatu iz zajedničkog pothvata"
"2013","Obveze prema zadrugarima iz rezultata","Obveze prema zadrugarima iz rezultata"
"2014","Obveze iz dobitka prema tajnim članovima","Obveze iz dobitka prema tajnim članovima"
"2015","Ostale obveze s osnove udjela u dobitku","Ostale obveze s osnove udjela u dobitku"
"21","KRATKOROČNE FINANCIJSKE OBVEZE","KRATKOROČNE FINANCIJSKE OBVEZE"
"210","Obveze za izdane čekove","Obveze za izdane čekove"
"211","Obveze za izdane mjenice","Obveze za izdane mjenice"
"2110","Obveze za dane mjenice","Obveze za dane mjenice"
"2111","Obveze za dane mjenične akcepte","Obveze za dane mjenične akcepte"
"212","Obveze po izdanim vrijednosnim papirima","Obveze po izdanim vrijednosnim papirima"
"2120","Obveze po izdanim komercijalnim zapisima","Obveze po izdanim komercijalnim zapisima"
"2121","Obveze po izdanim obveznicama","Obveze po izdanim obveznicama"
"2122","Obveze po izdanim zadužnicama","Obveze po izdanim zadužnicama"
"2123","Obveze po ostalim kratkoročnim vrijednosnim papirima","Obveze po ostalim kratkoročnim vrijednosnim papirima"
"2128","Obveze za kamate sadržane u vrijed. papirima","Obveze za kamate sadržane u vrijed. papirima"
"213","Obveze prema poduzetnicima u kojima postoje sudjelujući interesi (do 20% udjela)","Obveze prema poduzetnicima u kojima postoje sudjelujući interesi (do 20% udjela)"
"214","Obveze s osnove zajmova, depozita i sl.","Obveze s osnove zajmova, depozita i sl."
"2140","Obveze za financijske zajmove od društava","Obveze za financijske zajmove od društava"
"2141","Obveze za zajmove od ustanova, zadruga i sl.","Obveze za zajmove od ustanova, zadruga i sl."
"2142","Obveze za kratkoročne zajmove iz inozemstva","Obveze za kratkoročne zajmove iz inozemstva"
"2143","Obveze za dio dospjelih dugoročnih zajmova koji se trebaju platiti u roku 12 mj.","Obveze za dio dospjelih dugoročnih zajmova koji se trebaju platiti u roku 12 mj."
"2144","Obveze za zajmove prema građanima","Obveze za zajmove prema građanima"
"2145","Obveze za zajmove članova društva","Obveze za zajmove članova društva"
"2146","Obveze po kontokorentnom računu","Obveze po kontokorentnom računu"
"2147","Obveze za depozite, jamčevine i kapare","Obveze za depozite, jamčevine i kapare"
"2148","Obveze za kaucije","Obveze za kaucije"
"2149","Ostali kratkoročni zajmovi i sl.","Ostali kratkoročni zajmovi i sl."
"215","Obveze prema bankama i drugim financijskim institucijama","Obveze prema bankama i drugim financijskim institucijama"
"2150","Obveze za kratkoročne kredite u banci (analitika po bankama a unutar banke po ugovorima o kreditu)","Obveze za kratkoročne kredite u banci (analitika po bankama a unutar banke po ugovorima o kreditu)"
"2151","Obveze za kratkoročne kredite u osiguravajućim društvima (analitika po društvima i kreditima)","Obveze za kratkoročne kredite u osiguravajućim društvima (analitika po društvima i kreditima)"
"2152","Obveze prema ostalim kreditnim institucijama (štedionicama, mirovinskom fondu i dr.)","Obveze prema ostalim kreditnim institucijama (štedionicama, mirovinskom fondu i dr.)"
"2153","Obveze prema kreditnim institucijama i bankama u inozemstvu","Obveze prema kreditnim institucijama i bankama u inozemstvu"
"2154","Obveze prema bankama po naplaćenim garancijama","Obveze prema bankama po naplaćenim garancijama"
"2155","Obveze po isplaćenom akreditivu","Obveze po isplaćenom akreditivu"
"2156","Obveze za prekoračenje na računu (okvirni kredit)","Obveze za prekoračenje na računu (okvirni kredit)"
"2157","Obveze za kamate prema bankama","Obveze za kamate prema bankama"
"2158","Obveze za kamate prema financ. institucijama","Obveze za kamate prema financ. institucijama"
"2159","Ostale obveze prema kreditnim institucijama","Ostale obveze prema kreditnim institucijama"
"216","Obveze prema izdavateljima kreditnih kartica (analitika prema kartičarima)","Obveze prema izdavateljima kreditnih kartica (analitika prema kartičarima)"
"217","Obveze iz eskontnih poslova","Obveze iz eskontnih poslova"
"2170","Obveze s temelja eskontiranih mjenica","Obveze s temelja eskontiranih mjenica"
"2171","Ostale obveze iz eskonta vrijednosnih papira","Ostale obveze iz eskonta vrijednosnih papira"
"2172","Obveze iz otkupa tražbina","Obveze iz otkupa tražbina"
"218","Obveze s osnove dugotrajne imovine namijenjene prodaji (analitika prema izvorima)","Obveze s osnove dugotrajne imovine namijenjene prodaji (analitika prema izvorima)"
"22","OBVEZE PREMA DOBAVLJAČIMA, ZA PREDUJMOVE I OSTALE OBVEZE","OBVEZE PREMA DOBAVLJAČIMA, ZA PREDUJMOVE I OSTALE OBVEZE"
"220","Obveze prema dobavljačima u zemlji (analitika prema dobavljačima)","Obveze prema dobavljačima u zemlji (analitika prema dobavljačima)"
"2200","Dobavljači dobara","Dobavljači dobara"
"2201","Dobavljači usluga","Dobavljači usluga"
"2202","Dobavljači opreme, postrojenja i nekretnina","Dobavljači opreme, postrojenja i nekretnina"
"2203","Dobavljači nematerijalne imovine","Dobavljači nematerijalne imovine"
"2204","Dobavljači iz operativnog lizinga (za najmove)","Dobavljači iz operativnog lizinga (za najmove)"
"2205","Dobavljači iz ortačkog ugovora","Dobavljači iz ortačkog ugovora"
"2206","Dobavljači zadruge, ustanove i dr.","Dobavljači zadruge, ustanove i dr."
"221","Dobavljači iz inozemstva (analitika prema dobavljačima)","Dobavljači iz inozemstva (analitika prema dobavljačima)"
"2210","Dobavljači dobara iz inozemstva","Dobavljači dobara iz inozemstva"
"2211","Dobavljači usluga iz inozemstva","Dobavljači usluga iz inozemstva"
"2212","Dobavljači prava intelektualnog vlasništva, istraživanja tržišta i dr.","Dobavljači prava intelektualnog vlasništva, istraživanja tržišta i dr."
"2213","Dobavljači prava na franšizu i sl.","Dobavljači prava na franšizu i sl."
"222","Dobavljači fizičke osobe","Dobavljači fizičke osobe"
"2220","Dobavljači, obrtnici i slobodna zanimanja","Dobavljači, obrtnici i slobodna zanimanja"
"2221","Dobavljači fizičke osobe (za isporučene osnovne proizvode poljodjelstva, ribarstva i šumarstva)","Dobavljači fizičke osobe (za isporučene osnovne proizvode poljodjelstva, ribarstva i šumarstva)"
"2222","Dobavljači za isporučenu osobnu imovinu","Dobavljači za isporučenu osobnu imovinu"
"2223","Obveze s osnove autorskih prava, inovacija, patenata i sl.","Obveze s osnove autorskih prava, inovacija, patenata i sl."
"2224","Obveze s osnove ugovora o djelu i akviziterstva","Obveze s osnove ugovora o djelu i akviziterstva"
"2225","Obveze prema studentima i učenicima za rad preko studentskog servisa","Obveze prema studentima i učenicima za rad preko studentskog servisa"
"2226","Dobavljači kooperanti - fizičke osobe","Dobavljači kooperanti - fizičke osobe"
"2229","Ostali dobavljači - fizičke osobe","Ostali dobavljači - fizičke osobe"
"223","Dobavljači komunalnih usluga","Dobavljači komunalnih usluga"
"2230","Obveze za energetske isporuke","Obveze za energetske isporuke"
"2231","Obveze za usluge odvodnje i odvoza smeća","Obveze za usluge odvodnje i odvoza smeća"
"2232","Obveze za ostale komunalne usluge","Obveze za ostale komunalne usluge"
"224","Obveze za nefakturirane a preuzete isporuke robe i usluge","Obveze za nefakturirane a preuzete isporuke robe i usluge"
"225","Obveze za predujmove","Obveze za predujmove"
"2250","Primljeni predujmovi za koje su izdani računi s PDV-om","Primljeni predujmovi za koje su izdani računi s PDV-om"
"2251","Primljeni predujmovi koji nisu pod PDV-om","Primljeni predujmovi koji nisu pod PDV-om"
"2252","Primljeni predujmovi iz inozemstva","Primljeni predujmovi iz inozemstva"
"2253","Obveze za predujmove građana","Obveze za predujmove građana"
"23","OBVEZE PREMA ZAPOSLENIMA I OSTALE OBVEZE","OBVEZE PREMA ZAPOSLENIMA I OSTALE OBVEZE"
"230","Obveze prema zaposlenicima","Obveze prema zaposlenicima"
"2300","Obveze za neto-plaće","Obveze za neto-plaće"
"2301","Nadoknade plaća koje se refundiraju (od državnih institucija, od HZZO, od lokalne samoupr.)","Nadoknade plaća koje se refundiraju (od državnih institucija, od HZZO, od lokalne samoupr.)"
"2302","Obveze za nadoknade troškova (dnevnice, terenski dod.,troškovi sl. puta, km,dolazak na posao i dr.)","Obveze za nadoknade troškova (dnevnice, terenski dodatak, nadoknade troškova službenog puta, uključivo i kilometraža, nadoknade za dolazak na posao i dr.)"
"2303","Obveze za darove i potpore (božićnica, dar djeci, potpora zbog bolesti, regres za g. o. i sl.)","Obveze za darove i potpore (božićnica, dar djeci, potpora zbog bolesti, regres za g. o. i sl.)"
"2304","Obveze prema zaposlenima za primitke koji se smatraju dohotkom (prehrana, davanja u naravi i sl.)","Obveze prema zaposlenima za primitke koji se smatraju dohotkom (prehrana, davanja u naravi i sl.)"
"2305","Obveze prema zaposlenima zbog otpremnine, jubilarne, odvojeni život, pomoć obitelji umrlog posloprimca","Obveze prema zaposlenima s temelja otpremnine, jubilarne nagrade, nadoknade za odvojeni život, pomoći obitelji umrlog posloprimca i sl."
"2306","Obveze za obustave iz neto-plaća i nadoknada plaća","Obveze za obustave iz neto-plaća i nadoknada plaća"
"23060","Obveze za obustave iz neto-plaće za isplate kredita i pozajmica","Obveze za obustave iz neto-plaće za isplate kredita i pozajmica"
"23061","Obveze za obustave iz neto-plaća i nadoknada za sudske zabrane, kazne i sl.","Obveze za obustave iz neto-plaća i nadoknada za sudske zabrane, kazne i sl."
"23062","Obveze iz ovrha na neto-plaći","Obveze iz ovrha na neto-plaći"
"23063","Obveze za obustave iz neto-plaća i nadoknada plaća za članarine, i dr.","Obveze za obustave iz neto-plaća i nadoknada plaća za članarine, i dr."
"2307","Obveze prema zaposlenima za zatezne kamate i sl.","Obveze prema zaposlenima za zatezne kamate i sl."
"2308","Obveza prema zaposlenima za naknadu šteta: zbog ozljede na radu, neiskorištenog godišnjeg odmora i sl.","Obveza prema zaposlenima za naknadu šteta: zbog ozljede na radu, neiskorištenog godišnjeg odmora i sl."
"2309","Obveze za obračunanu bruto-plaću iz prošle poslovne godine (koje nisu isplaćene i XIII. plaća)","Obveze za obračunanu bruto-plaću iz prošle poslovne godine (koje nisu isplaćene i XIII. plaća)"
"231","Kratkoročne obveze iz nabava i potpora","Kratkoročne obveze iz nabava i potpora"
"2310","Obveze s temelja tekuće nabave u gotovini","Obveze s temelja tekuće nabave u gotovini"
"2311","Obveze prema vanjskim članovima uprave, nadzornog odbora, prokuristima, stečajnim upraviteljima i sl.","Obveze prema vanjskim članovima uprave, nadzornog odbora, prokuristima, stečajnim upraviteljima i sl."
"2312","Obveze za preuzeta plaćanja temeljem ugovora o cesiji, asignaciji i preuzimanjem duga","Obveze za preuzeta plaćanja temeljem ugovora o cesiji, asignaciji i preuzimanjem duga"
