"code","name","note"
"297","Nerealizirani dobitci iz financijske imovine (HSFI 9 i MRS 39)","Nerealizirani dobitci iz financijske imovine (HSFI 9 i MRS 39)"
"298","Rezerviranje troška za neiskorištene godišnje odmore","Rezerviranje troška za neiskorištene godišnje odmore"
"299","Ostala pasivna vremenska razgraničenja","Ostala pasivna vremenska razgraničenja"
"2999","Ostala pasivna vremenska razgraničenja troškova","Ostala pasivna vremenska razgraničenja troškova"
"3","ZALIHE SIROVINA I MATERIJALA, REZERVNIH DIJELOVA I SITNOG INVENTARA","ZALIHE SIROVINA I MATERIJALA, REZERVNIH DIJELOVA I SITNOG INVENTARA"
"30","OBRAČUN TROŠKOVA KUPNJE ZALIHA","OBRAČUN TROŠKOVA KUPNJE ZALIHA"
"300","Kupovna cijena dobavljača","Kupovna cijena dobavljača"
"3000","Fakturna cijena sirovina i materijala na putu","Fakturna cijena sirovina i materijala na putu"
"3001","Fakturna cijena sirovina i materijala","Fakturna cijena sirovina i materijala"
"3002","Fakturna cijena rezervnih dijelova","Fakturna cijena rezervnih dijelova"
"3003","Fakturna cijena sitnog inventara, autoguma i ambalaže","Fakturna cijena sitnog inventara, autoguma i ambalaže"
"3005","Materijal i dijelovi u preuzimanju (nema dokumentacije)","Materijal i dijelovi u preuzimanju (nema dokumentacije)"
"301","Ovisni troškovi nabave (u svezi s dovođenjem na zalihu)","Ovisni troškovi nabave (u svezi s dovođenjem na zalihu)"
"3010","Troškovi transporta","Troškovi transporta"
"3011","Troškovi ukrcaja i iskrcaja (fakturirani)","Troškovi ukrcaja i iskrcaja (fakturirani)"
"3012","Transportno osiguranje i čuvanje","Transportno osiguranje i čuvanje"
"3013","Posebni troškovi pakiranja - ambalaže","Posebni troškovi pakiranja - ambalaže"
"3014","Troškovi vlastitog transporta","Troškovi vlastitog transporta"
"3015","Troškovi vlastitog ukrcaja i iskrcaja","Troškovi vlastitog ukrcaja i iskrcaja"
"3016","Troškovi špeditera","Troškovi špeditera"
"3017","Troškovi atesta i kontrole","Troškovi atesta i kontrole"
"3018","Troškovi dorade i oplemenjivanja za vrijeme dovođenja na zalihu","Troškovi dorade i oplemenjivanja za vrijeme dovođenja na zalihu"
"3019","Ostali ovisni troškovi nabave","Ostali ovisni troškovi nabave"
"302","Carina i druge uvozne pristojbe","Carina i druge uvozne pristojbe"
"303","Posebni porezi (trošarine) koji se ne mogu odbiti","Posebni porezi (trošarine) koji se ne mogu odbiti"
"309","Obračun troškova kupnje","Obračun troškova kupnje"
"3090","Obračun nabave sirovina i materijala, dijelova i sitnog inventara koji se skladišti","Obračun nabave sirovina i materijala, dijelova i sitnog inventara koji se skladišti"
"3091","Obračun nabave sirovina i materijala i dijelova koji izravno terete troškove","Obračun nabave sirovina i materijala i dijelova koji izravno terete troškove"
"31","SIROVINE I MATERIJAL NA ZALIHI","SIROVINE I MATERIJAL NA ZALIHI"
"310","Sirovine i materijal u skladištu","Sirovine i materijal u skladištu"
"3100","Zalihe sirovina i materijala","Zalihe sirovina i materijala"
"3101","Zalihe goriva i maziva","Zalihe goriva i maziva"
"3102","Poluproizvodi za ugradnju ili proizvodnju","Poluproizvodi za ugradnju ili proizvodnju"
"3103","Uredski materijal i pribor","Uredski materijal i pribor"
"3104","Zalihe materijala s temelja povezane proizvodnje","Zalihe materijala s temelja povezane proizvodnje"
"3105","Zalihe ambalažnog materijala","Zalihe ambalažnog materijala"
"3106","Zalihe materijala kod kooperanata","Zalihe materijala kod kooperanata"
"3107","Materijal na zalihi u javnom ili drugom skladištu","Materijal na zalihi u javnom ili drugom skladištu"
"3108","Zalihe pića, hrane i dr. u ugostiteljstvu i hotelijerstvu","Zalihe pića, hrane i dr. u ugostiteljstvu i hotelijerstvu"
"3109","Zalihe otpadnog i rashodovanog materijala","Zalihe otpadnog i rashodovanog materijala"
"311","Materijal u doradi, obradi i manipulaciji","Materijal u doradi, obradi i manipulaciji"
"3110","Materijal u doradi, obradi i oplemenjivanju","Materijal u doradi, obradi i oplemenjivanju"
"3111","Materijal u manipulaciji i na putu","Materijal u manipulaciji i na putu"
"3112","Troškovi dorade, obrade i oplemenjivanja","Troškovi dorade, obrade i oplemenjivanja"
"312","Materijal na doradi kod ortaka","Materijal na doradi kod ortaka"
"313","Zalihe materijala za poljoprivredu","Zalihe materijala za poljoprivredu"
"3130","Zalihe sjemena i sadnog materijala","Zalihe sjemena i sadnog materijala"
"3131","Zalihe komponenti za proizvodnju","Zalihe komponenti za proizvodnju"
"318","Odstupanje od cijene zaliha","Odstupanje od cijene zaliha"
"319","Vrijednosno usklađenje zaliha sirovina i materijala","Vrijednosno usklađenje zaliha sirovina i materijala"
"32","ZALIHE REZERVNIH DIJELOVA","ZALIHE REZERVNIH DIJELOVA"
"320","Rezervni dijelovi na zalihi","Rezervni dijelovi na zalihi"
"3200","Rezervni dijelovi za servisne usluge","Rezervni dijelovi za servisne usluge"
"3201","Dijelovi i sklopovi za ugradnju (u proizvode)","Dijelovi i sklopovi za ugradnju (u proizvode)"
"3202","Rezervni dijelovi za tekuće i investicijsko održavanje","Rezervni dijelovi za tekuće i investicijsko održavanje"
"3203","Zalihe polovnih rezervnih dijelova","Zalihe polovnih rezervnih dijelova"
"3204","Zalihe otpadaka rezervnih dijelova","Zalihe otpadaka rezervnih dijelova"
"328","Odstupanje od cijene dijelova na zalihi","Odstupanje od cijene dijelova na zalihi"
"329","Vrijednosno usklađenje zaliha rezervnih dijelova","Vrijednosno usklađenje zaliha rezervnih dijelova"
"35","ZALIHE SITNOG INVENTARA","ZALIHE SITNOG INVENTARA"
"350","Sitan inventar na zalihi","Sitan inventar na zalihi"
"3500","Sitan inventar na zalihi (analitika prema vrstama: alati, mjerni instrumenti, pribori,odjeća, i dr.)","Sitan inventar na zalihi (analitika prema vrstama: alati, mjerni instrumenti, pribori, ostala sredstva rada male vrijednosti, radna i zaštitna odjeća, protupožarna i sanitetska sredstva, i dr.)"
"351","Ambalaža na zalihi (samo vlastita i višekratna, analitika prema vrstama)","Ambalaža na zalihi (samo vlastita i višekratna, analitika prema vrstama)"
"352","Autogume na zalihi","Autogume na zalihi"
"358","Odstupanje od cijene","Odstupanje od cijene"
"359","Vrijednosno usklađenje zaliha","Vrijednosno usklađenje zaliha"
"36","ZALIHE SITNOG INVENTARA U UPORABI","ZALIHE SITNOG INVENTARA U UPORABI"
"360","Sitan inventar u uporabi","Sitan inventar u uporabi"
"361","Ambalaža u uporabi","Ambalaža u uporabi"
"362","Autogume u uporabi","Autogume u uporabi"
"363","Otpis sitnog inventara","Otpis sitnog inventara"
"364","Otpis ambalaže","Otpis ambalaže"
"365","Otpis autoguma","Otpis autoguma"
"369","Vrijednosno usklađenje sitnog inventara, ambalaže i autoguma","Vrijednosno usklađenje sitnog inventara, ambalaže i autoguma"
"37","PREDUJMOVI DOBAVLJAČIMA SIROVINA I MATERIJALA, REZERVNIH DIJELOVA, SITNOG INVENTARA I AUTOGUMA","PREDUJMOVI DOBAVLJAČIMA SIROVINA I MATERIJALA, REZERVNIH DIJELOVA, SITNOG INVENTARA I AUTOGUMA"
"370","Predujmovi dobavljačima materijala","Predujmovi dobavljačima materijala"
"371","Predujmovi dobavljačima rezervnih dijelova","Predujmovi dobavljačima rezervnih dijelova"
"372","Predujmovi dobavljačima sitnog inventara","Predujmovi dobavljačima sitnog inventara"
"373","Predujmovi dani uvozniku za nabavu sirovina i materijala, dijelova i inventara","Predujmovi dani uvozniku za nabavu sirovina i materijala, dijelova i inventara"
"374","Predujmovi inozemnim dobavljačima","Predujmovi inozemnim dobavljačima"
"379","Vrijednosno usklađenje danih predujmova","Vrijednosno usklađenje danih predujmova"
"4","TROŠKOVI PREMA VRSTAMA, FINANCIJSKI I OSTALI RASHODI","TROŠKOVI PREMA VRSTAMA, FINANCIJSKI I OSTALI RASHODI"
"40","MATERIJALNI TROŠKOVI","MATERIJALNI TROŠKOVI"
"400","Troškovi sirovina i materijala (za proizvodnju dobara i usluga)","Troškovi sirovina i materijala (za proizvodnju dobara i usluga)"
"4000","Osnovni materijali i sirovine","Osnovni materijali i sirovine"
"4001","Dijelovi i sklopovi","Dijelovi i sklopovi"
"4002","Poluproizvodi za ugradnju","Poluproizvodi za ugradnju"
"4003","Pomoćni materijali (mazivo, ljepila, svrdla, pile, noževi, brusne ploče i dr.)","Pomoćni materijali (mazivo, ljepila, svrdla, pile, noževi, brusne ploče i dr.)"
"4004","Potrošni materijal za čišćenje i održavanje","Potrošni materijal za čišćenje i održavanje"
"4005","Materijal za HTZ zaštitu, radna i zaštitna odjeća i obuća","Materijal za HTZ zaštitu, radna i zaštitna odjeća i obuća"
"4006","Materijal pogonske administracije i menadžmenta (uredski potrošni i sl.)","Materijal pogonske administracije i menadžmenta (uredski potrošni i sl.)"
"4007","Troškovi oblikovanja proizvoda za posebne kupce","Troškovi oblikovanja proizvoda za posebne kupce"
"4008","Materijali u pomoćnoj djelatnosti (za restoran i dr.)","Materijali u pomoćnoj djelatnosti (za restoran i dr.)"
"4009","Ostali izravni i opći troškovi pogona - uslužne jedinice (HSFI t. 10.17 i MRS 2, t. 10. do 19.)","Ostali izravni i opći troškovi pogona - uslužne jedinice (HSFI t. 10.17 i MRS 2, t. 10. do 19.)"
"401","Materijalni troškovi administracije, uprave i prodaje","Materijalni troškovi administracije, uprave i prodaje"
"4010","Uredski materijal (papir, registratori, olovke, tiskanice, toneri, ulošci, kalendari, rokovnici i sl.)","Uredski materijal (papir, registratori, olovke, tiskanice, toneri, ulošci, kalendari, rokovnici i sl.)"
"4011","Materijal i sredstva za čišćenje i održavanje","Materijal i sredstva za čišćenje i održavanje"
"4012","Troškovi otpisa sitnog inventara","Troškovi otpisa sitnog inventara"
"4013","Ambalažni materijal, vrpce za blagajne, blokovi papira, pisači, naljepnice, etikete i dr.","Ambalažni materijal, vrpce za blagajne, blokovi papira, pisači, naljepnice, etikete i dr."
"4014","Voda (izvorska) za piće","Voda (izvorska) za piće"
"4015","Uniformirana radna odjeća i obuća","Uniformirana radna odjeća i obuća"
"4016","Troškovi opomena","Troškovi opomena"
"4017","Troškovi ukrasnog bilja","Troškovi ukrasnog bilja"
"4019","Ostali materijalni troškovi trgovine","Ostali materijalni troškovi trgovine"
"402","Troškovi istraživanja i razvoja (Zak. o znan - Nn. br. 46/07.)","Troškovi istraživanja i razvoja (Zak. o znan - Nn. br. 46/07.)"
"4020","Troškovi projekta za temeljna istraživanja proizvoda","Troškovi projekta za temeljna istraživanja proizvoda"
"403","Troškovi ambalaže","Troškovi ambalaže"
"4030","Troškovi neodvojive ambalaže u proizvodnji (boce, limenke, kutije i dr.)","Troškovi neodvojive ambalaže u proizvodnji (boce, limenke, kutije i dr.)"
"4031","Troškovi paleta, gajbi i sl.","Troškovi paleta, gajbi i sl."
"404","Trošak sitnog inventara, ambalaže i autoguma","Trošak sitnog inventara, ambalaže i autoguma"
"4040","Troškovi sitnog inventara,","Troškovi sitnog inventara,"
"4041","Troškovi ambalaže (povratne, posebne) - otpis","Troškovi ambalaže (povratne, posebne) - otpis"
"4042","Troškovi autoguma (za kamione, autobuse, teretna vozila i strojeve)","Troškovi autoguma (za kamione, autobuse, teretna vozila i strojeve)"
"4044","Trokš. auto guma (neto + 30% PDV) za slučaj plaće","Trokš. auto guma (neto + 30% PDV) za slučaj plaće"
"4045","70% troška autoguma za os. automobile i dr. sredstva prijevoza za potrebe administr., uprave i prodaje","70% troška autoguma za osobne automobile i dr. sredstva prijevoza za potrebe administr., uprave i prodaje"
"4046","30% troška inventara i autoguma za osobne automobile +30% PDV-a","30% troška inventara i autoguma za osobne automobile +30% PDV-a"
"405","Potrošeni rezervni dijelovi i materijal za održavanje","Potrošeni rezervni dijelovi i materijal za održavanje"
"4050","Potrošeni rezervni dijelovi za popravak vlastite opreme","Potrošeni rezervni dijelovi za popravak vlastite opreme"
"4051","Materijal za održavanje opreme i objekata","Materijal za održavanje opreme i objekata"
"4054","Trošak rez. dijelova (neto + 30% PDV) za slučaj plaće","Trošak rez. dijelova (neto + 30% PDV) za slučaj plaće"
"4055","70% troškova rez. dijelova i mat. za automob., plovila i zrakopl.za prijevoz(čl.7.,st.1.,t.4.ZoPD)","70% troškova rezervnih dijelova i materijala za popravak automob., plovila i zrakopl. koji služe za osobni prijevoz poduzet. i zaposlenih (čl. 7., st. 1., t. 4. ZoPD)"
"4056","30% troška rezervnih dijelova i materijala za održavanje automobila i dr. za osobni prijevoz +30% PDV-a","30% troška rezervnih dijelova i materijala za održavanje automobila i dr. za osobni prijevoz +30% PDV-a"
"4057","Troškovi zamjene u jamstvenom roku","Troškovi zamjene u jamstvenom roku"
"4058","Potrošeni vlastiti proizvodi i roba za održavanje","Potrošeni vlastiti proizvodi i roba za održavanje"
"4059","Ostali troškovi rezervnih dijelova","Ostali troškovi rezervnih dijelova"
"406","Potrošena energija u proizvodnji dobara i usluga","Potrošena energija u proizvodnji dobara i usluga"
"4060","Električna energija","Električna energija"
"4061","Plin, para, briketi i drva","Plin, para, briketi i drva"
"4062","Mazut i ulje za loženje","Mazut i ulje za loženje"
"4063","Dizelsko gorivo, benzin i motorno ulje (za stroj. i sl.)","Dizelsko gorivo, benzin i motorno ulje (za stroj. i sl.)"
"4067","Trošak goriva za teretna vozila (kamione, autobuse, strojeve, brodove i sl.)","Trošak goriva za teretna vozila (kamione, autobuse, strojeve, brodove i sl.)"
"4069","Ostali troškovi energije u proizvodnji","Ostali troškovi energije u proizvodnji"
"407","Potrošena energija u administraciji, upravi i prodaji","Potrošena energija u administraciji, upravi i prodaji"
"4070","Trošak električne energije","Trošak električne energije"
"4071","Plin, toplinska energija, briketi, drva","Plin, toplinska energija, briketi, drva"
"4074","Gorivo za osob. aut. (neto + 30% PDV) za sluč. plaće","Gorivo za osob. aut. (neto + 30% PDV) za sluč. plaće"
"4075","70% troškova goriva za pogon automobila za osobni prijevoz(i automobila u najmu)","70% troškova diesela i benzina za pogon automobila, plovila i zrakoplova za osobni prijevoz poduzetnika i zaposlenih te za istu namjenu automobila u najmu"
"4076","30% goriva za osobni prijevoz +30% PDV-a","30% goriva za osobni prijevoz +30% PDV-a"
"4077","Trošak goriva za teretna vozila, strojeve i brodove","Trošak goriva za teretna vozila, strojeve i brodove"
"4079","Ostali troškovi energije","Ostali troškovi energije"
"408","Troškovi energije na pomoćnim mjestima u proizvodnji","Troškovi energije na pomoćnim mjestima u proizvodnji"
"409","Odstupanja od standardnog troška","Odstupanja od standardnog troška"
"41","OSTALI VANJSKI TROŠKOVI (TROŠKOVI USLUGA)","OSTALI VANJSKI TROŠKOVI (TROŠKOVI USLUGA)"
"410","Troškovi telefona, prijevoza i sl.","Troškovi telefona, prijevoza i sl."
"4100","Troškovi telefona, interneta i sl.","Troškovi telefona, interneta i sl."
"4101","Poštanski troškovi","Poštanski troškovi"
"4102","Prijevozne usluge u cestovnom prometu","Prijevozne usluge u cestovnom prometu"
"4103","Prijevozne usluge željeznicom","Prijevozne usluge željeznicom"
"4104","Prijevozne usluge brodara","Prijevozne usluge brodara"
"4105","Prijevozne usluge zrakoplova","Prijevozne usluge zrakoplova"
"4106","Troškovi specijalnih prijevoza","Troškovi specijalnih prijevoza"
"4107","Usluge taksi- prijevoza","Usluge taksi- prijevoza"
"4108","Usluge dostave i logistike","Usluge dostave i logistike"
"4109","Ostale usluge prijevoza","Ostale usluge prijevoza"
"411","Troškovi vanjskih usluga pri izradi dobara i obavljanju usluga","Troškovi vanjskih usluga pri izradi dobara i obavljanju usluga"
"4110","Usluge dorade (oplemenjivanja), izrade, prerade i sl. u proizvodnji i izgradnji","Usluge dorade (oplemenjivanja), izrade, prerade i sl. u proizvodnji i izgradnji"
"4111","Usluge kooperanata na zajedničkim uslugama prema trećima","Usluge kooperanata na zajedničkim uslugama prema trećima"
"4112","Usluge studentskog i omladinskog servisa i na izradi proizvoda","Usluge studentskog i omladinskog servisa i na izradi proizvoda"
"4113","Usluge pripreme teksta za tisak, za web. i sl.","Usluge pripreme teksta za tisak, za web. i sl."
"4114","Grafičke usluge tiska i uveza","Grafičke usluge tiska i uveza"
"4115","Usluge hotela i smještaja radnika na terenu","Usluge hotela i smještaja radnika na terenu"
"4116","Usluge za iznajmljeni kapacitet","Usluge za iznajmljeni kapacitet"
"4117","Usluge rada vanjskog osoblja","Usluge rada vanjskog osoblja"
"4118","Usluge izrade ili popravka po ugovoru o djelu","Usluge izrade ili popravka po ugovoru o djelu"
"4119","Ostale vanjske usluge na izradi dobara i proizvodnih usluga","Ostale vanjske usluge na izradi dobara i proizvodnih usluga"
"412","Usluge održavanja i zaštite (servisne usluge)","Usluge održavanja i zaštite (servisne usluge)"
"4120","Nabavljene usluge tekućeg održavanja (bez vlastitog materijala i dijelova)","Nabavljene usluge tekućeg održavanja (bez vlastitog materijala i dijelova)"
"4121","Nabavljene usluge za investicijsko održavanje i popravke (bez vlastitog materijala i dijelova)","Nabavljene usluge za investicijsko održavanje i popravke (bez vlastitog materijala i dijelova)"
"4122","Usluge čišćenja i pranja","Usluge čišćenja i pranja"
"4123","Usluge održavanja softvera i web stranica","Usluge održavanja softvera i web stranica"
"4124","Vanjske usluge popravka prodanih a neispravnih dobara u jamstvenom roku","Vanjske usluge popravka prodanih a neispravnih dobara u jamstvenom roku"
"41244","Servis osob. automob. (neto + 30% PDV) za slučaj plaće u naravi","Servis osob. automob. (neto + 30% PDV) za slučaj plaće u naravi"
"4125","70% usluga servisa za održavanje automobila za osobni prijevoz poduzetnika i zaposlenih","70% usluga servisa za održavanje automobila, plovila i zrakoplova koji služe za osobni prijevoz poduzetnika i zaposlenih"
"4126","30% usluga održavanja prijevoznih sredstava za osobni prijevoz + 30% PDV-a","30% usluga održavanja prijevoznih sredstava za osobni prijevoz + 30% PDV-a"
"4127","Usluge zaštite na radu i održavanja okoliša","Usluge zaštite na radu i održavanja okoliša"
"4128","Usluge zaštitara na čuvanju imovine i osoba","Usluge zaštitara na čuvanju imovine i osoba"
"4129","Ostale servisne usluge i usluge osoba","Ostale servisne usluge i usluge osoba"
"413","Usluge registracije prijevoznih sredstava i troškovi dozvola","Usluge registracije prijevoznih sredstava i troškovi dozvola"
"4130","70% troška registracije automobila, plovila i zrakoplova za prijevoz osoba poduz. (osim osiguranja)","70% troška registracije osobnih automobila, plovila i zrakoplova za prijevoz osoba poduzetnika (osim osiguranja)"
"4131","30% troška registracije sred. za osobni prijevoz + 30% PDV-a (osim troškova osiguranja)","30% troška registracije sred. za osobni prijevoz + 30% PDV-a (osim troškova osiguranja)"
"41314","Troškovi registr. (neto + 30% PDV) - plaća","Troškovi registr. (neto + 30% PDV) - plaća"
"4132","Trošak registracije dostavnih i teret. vozila i autobusa (sveuk.) i automob. bez poreznog ograničenja","Trošak registracije dostavnih i teret. vozila i autobusa (sveukupno) i automob. bez poreznog ograničenja"
"4133","Troškovi registracije plovila","Troškovi registracije plovila"
"4134","Troškovi registracije zrakoplova","Troškovi registracije zrakoplova"
"4135","Troškovi dozvola za prometne smjerove","Troškovi dozvola za prometne smjerove"
"4136","Troškovi koncesija, licencija i dr. prava na prijevoz","Troškovi koncesija, licencija i dr. prava na prijevoz"
"4137","Troškovi nadoknada za ceste, takse i sl.","Troškovi nadoknada za ceste, takse i sl."
"4139","Ostali troškovi registracije prometala","Ostali troškovi registracije prometala"
"414","Usluge zakupa - lizinga","Usluge zakupa - lizinga"
"4140","Zakupnine - najamnine nekretnina","Zakupnine - najamnine nekretnina"
"4141","Zakupnine opreme","Zakupnine opreme"
"4142","Usluge operativnog (poslovnog) lizinga opreme","Usluge operativnog (poslovnog) lizinga opreme"
"4143","70% usluga operativnog lizinga automobila, brodova i zrakoplova za osobni prijevoz osoba poduzetnika","70% usluga operativnog lizinga automobila, brodova i zrakoplova za osobni prijevoz osoba poduzetnika"
"4144","Usluge operat. najma osob. automob. (neto + 30% PDV) za slučaj plaće","Usluge operat. najma osob. automob. (neto + 30% PDV) za slučaj plaće"
"4145","70% rent-á-car usluge prijevoza osoba","70% rent-á-car usluge prijevoza osoba"
"4146","30% usluga operativnog lizinga sred. za osobni prijevoz + 30% PDV-a","30% usluga operativnog lizinga sred. za osobni prijevoz + 30% PDV-a"
"4147","30% rent-á-car usluga prijevoza osoba + 30% PDV-a","30% rent-á-car usluga prijevoza osoba + 30% PDV-a"
"4148","Rent-á-car za prijevoz tereta","Rent-á-car za prijevoz tereta"
"4149","Usluge najma informatičke opreme","Usluge najma informatičke opreme"
"415","Usluge promidžbe, sponzorstva i troškovi sajmova","Usluge promidžbe, sponzorstva i troškovi sajmova"
"4150","Troškovi promidžbe putem tiskovina, TV, plakata i sl.","Troškovi promidžbe putem tiskovina, TV, plakata i sl."
"4151","Usluge promidžbenih agencija","Usluge promidžbenih agencija"
"4152","Troškovi promidžbe u inozemstvu","Troškovi promidžbe u inozemstvu"
"4153","Trošak sponzoriranja športa i kulture u cilju promidžbe","Trošak sponzoriranja športa i kulture u cilju promidžbe"
"4154","Usluge unapređenja prodaje","Usluge unapređenja prodaje"
"4155","Usluge istraživanja tržišta","Usluge istraživanja tržišta"
"4156","Usluge sajmova (nadoknada za prostor)","Usluge sajmova (nadoknada za prostor)"
"4157","Usluge oblikovanja i uređenja izložbenog i prodajnog prostora","Usluge oblikovanja i uređenja izložbenog i prodajnog prostora"
"4158","Troškovi promidžbe najmom medija (stranica portala i sl.)","Troškovi promidžbe najmom medija (stranica portala i sl.)"
"4159","Ostali troškovi promidžbe (osim reprezentacije, dnevnica na službenom putu i sl.)","Ostali troškovi promidžbe (osim reprezentacije, dnevnica na službenom putu i sl.)"
"416","Intelektualne i osobne usluge","Intelektualne i osobne usluge"
"4160","Troškovi drugih dohodaka (ugovora o djelu, akvizitera, trgov. putnika, konzultanata)","Troškovi drugih dohodaka (ugovora o djelu, akvizitera, trgov. putnika, konzultanata)"
"4161","Autorski honorari (pisana, govorna, prijevodi i dr.)","Autorski honorari (pisana, govorna, prijevodi i dr.)"
"4162","Usluge specijalističkog obrazovanja, znanstvenoistraživačke usluge, usluge informacija i sl.","Usluge specijalističkog obrazovanja, znanstvenoistraživačke usluge, usluge informacija i sl."
"4163","Konzultantske i savjetničke usluge","Konzultantske i savjetničke usluge"
"4164","Knjigovodstvene usluge","Knjigovodstvene usluge"
"4165","Usluge poreznih savjetnika","Usluge poreznih savjetnika"
"4166","Usluge revizije i procjene vrijednosti poduzeća","Usluge revizije i procjene vrijednosti poduzeća"
"4167","Odvjetničke, bilježničke i usluge izrade pravnih akata","Odvjetničke, bilježničke i usluge izrade pravnih akata"
"4168","Naknade za korištenje prava intelektualnog vlasništva (licencije, ind. prava., robni znak i sl.)","Naknade za korištenje prava intelektualnog vlasništva (licencije, ind. prava., robni znak i sl.)"
"4169","Usluge vještačenja, administracijske usluge, i dr. intelektualne usluge","Usluge vještačenja, administracijske usluge, i dr. intelektualne usluge"
"417","Troškovi komunalnih i sličnih usluga","Troškovi komunalnih i sličnih usluga"
"4170","Komunalna naknada (za financ. izgradnje)","Komunalna naknada (za financ. izgradnje)"
"4171","Odvoz smeća i fekalija","Odvoz smeća i fekalija"
"4172","Voda i odvodnja","Voda i odvodnja"
"4173","Održavanje zelenila","Održavanje zelenila"
"4174","Usluge tržnica","Usluge tržnica"
"4175","Garažiranje i parkiranje vozila","Garažiranje i parkiranje vozila"
"4176","Deratizacija i dezinfekcijske usluge","Deratizacija i dezinfekcijske usluge"
"4177","Dimnjačarske i ekološke usluge","Dimnjačarske i ekološke usluge"
"4178","Veterinarske, sanitarne i usluge zbrinjavanja otpada","Veterinarske, sanitarne i usluge zbrinjavanja otpada"
"4179","Ostale komunalne i ekološke usluge","Ostale komunalne i ekološke usluge"
"418","Usluge reprezentacije - ugošćivanja i posredovanja","Usluge reprezentacije - ugošćivanja i posredovanja"
"4180","70% vanjskih usluga ugošćenja (reprezentacije) + 70% PDV-a","70% vanjskih usluga ugošćenja (reprezentacije) + 70% PDV-a"
"4181","30% vanjskih usluga ugošćenja (reprezentacije)","30% vanjskih usluga ugošćenja (reprezentacije)"
"4184","Usluge posredovanja pri nabavi dobara i usluga","Usluge posredovanja pri nabavi dobara i usluga"
"4185","Usluge posredovanja pri prodaji dobara i usluga","Usluge posredovanja pri prodaji dobara i usluga"
"4186","Usluge agenata i detektiva","Usluge agenata i detektiva"
"4187","Troškovi provizija za usluge","Troškovi provizija za usluge"
"419","Troškovi ostalih vanjskih usluga","Troškovi ostalih vanjskih usluga"
"4190","Usluge kontrole kakvoće i atestiranja dobara","Usluge kontrole kakvoće i atestiranja dobara"
"4191","Usluge studentskog servisa","Usluge studentskog servisa"
"4192","Hotelske usluge (osim reprezentacije)","Hotelske usluge (osim reprezentacije)"
"4193","Vanjskotrgovačke usluge","Vanjskotrgovačke usluge"
"4194","Špediterske usluge pri izvozu i sl.","Špediterske usluge pri izvozu i sl."
"4195","Troškovi oglašavanja u tisku za slobodna radna mjesta, objava fin. izvješća i sl. (osim promidžbe)","Troškovi oglašavanja u tisku za slobodna radna mjesta, objava fin. izvješća i sl. (osim promidžbe)"
"4196","Troškovi korištenja javnih skladišta, luka, pristaništa, hlađenja i sl.","Troškovi korištenja javnih skladišta, luka, pristaništa, hlađenja i sl."
