"code","name","note"
"4793","Troškovi burzovnih usluga, emisije vrijednosnih papira i sl.","Troškovi burzovnih usluga, emisije vrijednosnih papira i sl."
"4794","Troškovi carine inozemnog financijskog i operativnog lizinga","Troškovi carine inozemnog financijskog i operativnog lizinga"
"4799","Ostali nespomenuti financijski troškovi","Ostali nespomenuti financijski troškovi"
"48","OSTALI POSLOVNI RASHODI","OSTALI POSLOVNI RASHODI"
"480","Trošak naknadnih popusta, sniženja, reklamacija i troškovi uzoraka","Trošak naknadnih popusta, sniženja, reklamacija i troškovi uzoraka"
"4800","Naknadno odobreni popusti i odobrenja","Naknadno odobreni popusti i odobrenja"
"4801","Troškovi nagodbe (razlike iz sniženja)","Troškovi nagodbe (razlike iz sniženja)"
"4802","Troškovi nenadoknađenih jamstava za prodana dobra","Troškovi nenadoknađenih jamstava za prodana dobra"
"4803","Troškovi naknadnih reklamacija","Troškovi naknadnih reklamacija"
"4804","Troškovi uzoraka zbog kontrole i pregleda, izlaganje radi prodaje i sl.","Troškovi uzoraka zbog kontrole i pregleda, izlaganje radi prodaje i sl."
"481","Otpisi vrijednosno neusklađenih potraživanja","Otpisi vrijednosno neusklađenih potraživanja"
"4810","Otpisi nenaplaćenih jamstava i drugih osiguranja","Otpisi nenaplaćenih jamstava i drugih osiguranja"
"4811","Izravni otpisi nenaplaćenih potraživanja od kupaca i drugih koja nisu vrijednosno usklađena","Izravni otpisi nenaplaćenih potraživanja od kupaca i drugih koja nisu vrijednosno usklađena"
"4812","Troškovi ostalih otpisa","Troškovi ostalih otpisa"
"482","Rashodi - otpisi nematerijalne i materijalne imovine","Rashodi - otpisi nematerijalne i materijalne imovine"
"4820","Neamortizirana vrijednost rashodovane, uništene ili otuđene dugotrajne imovine","Neamortizirana vrijednost rashodovane, uništene ili otuđene dugotrajne imovine"
"4821","Otpisi imovine izvan uporabe - rashod","Otpisi imovine izvan uporabe - rashod"
"4822","Gubitak od prodane dug. imov. koja se ne amortizira","Gubitak od prodane dug. imov. koja se ne amortizira"
"4823","Gubitak od prodaje ost. dug. mat. i nemat. imovine","Gubitak od prodaje ost. dug. mat. i nemat. imovine"
"4824","Otpisi materijala i robe - rashod","Otpisi materijala i robe - rashod"
"483","Manjkovi i provalne krađe na zalihama i drugim sredstvima","Manjkovi i provalne krađe na zalihama i drugim sredstvima"
"4830","Manjkovi uslijed više sile (provalna krađa, elementarna nepogoda)","Manjkovi uslijed više sile (provalna krađa, elementarna nepogoda)"
"4831","Dopušteni manjkovi - kalo, rastep, kvar i lom na zalihama prema odlukama HGK, HOK ili internim aktima","Dopušteni manjkovi - kalo, rastep, kvar i lom na zalihama prema odlukama HGK, HOK ili internim aktima"
"4832","Prekomjerni manjkovi na zalihama (KRL) iznad normativa+PDV, prema HGK,(čl.7.,st.5.ZoPD)","Prekomjerni manjkovi na zalihama (kalo, rastep, kvar i lom) iznad normativa + PDV, prema odlukama HGK, HOK ili interno - skrivene isplate (čl. 7., st. 5. ZoPD)"
"4833","Manjkovi novca i vrijednosnih papira","Manjkovi novca i vrijednosnih papira"
"4839","Ostali manjkovi iz imovine","Ostali manjkovi iz imovine"
"484","Kazne, penali, nadoknade šteta i troškovi iz ugovora","Kazne, penali, nadoknade šteta i troškovi iz ugovora"
"4840","Troškovi kazni za prijestupe i prekršaje i sl. (čl. 7., st. 1., t. 7. ZoPD)","Troškovi kazni za prijestupe i prekršaje i sl. (čl. 7., st. 1., t. 7. ZoPD)"
"4841","Troškovi prisilne naplate poreza i dr. davanja (čl. 7., st. 1., t. 6. ZoPD)","Troškovi prisilne naplate poreza i dr. davanja (čl. 7., st. 1., t. 6. ZoPD)"
"4842","Penali, ležarine, dangubnine","Penali, ležarine, dangubnine"
"4843","Nadoknade šteta iz radnog odnosa (npr. za godišnji odmor, ozljede na radu, odštetne rente i sl.)","Nadoknade šteta iz radnog odnosa (npr. za neiskorišteni godišnji odmor, zbog ozljede na radu, odštetne rente i sl.)"
"4844","Nadoknade štete drugim društvima, fizičkim osobama po nagodbama i sudskim presudama","Nadoknade štete drugim društvima, fizičkim osobama po nagodbama i sudskim presudama"
"4845","Ugovorene kazne i penali zbog neizvršenja, propusta i sl.","Ugovorene kazne i penali zbog neizvršenja, propusta i sl."
"4846","Troškovi preuzetih obveza iz ugovora","Troškovi preuzetih obveza iz ugovora"
"4847","Kazne za parkiranje","Kazne za parkiranje"
"4849","Ostali izdatci za štete","Ostali izdatci za štete"
"485","Naknadno utvrđeni troškovi poslovanja","Naknadno utvrđeni troškovi poslovanja"
"4850","Naknadno utvrđeni troškovi - računi iz prethodnih godina","Naknadno utvrđeni troškovi - računi iz prethodnih godina"
"4851","Troškovi naknadnih razlika iz nabava","Troškovi naknadnih razlika iz nabava"
"4852","Ispravak pogrešaka prethodnih razdoblja","Ispravak pogrešaka prethodnih razdoblja"
"486","Darovanje do 2% od ukupnog prihoda","Darovanje do 2% od ukupnog prihoda"
"4860","Darovanje za općekorisne namjene (u novcu ili naravi do 2% od UP pr.god.  - čl. 7., st. 7. ZoPD)","Darovanje za općekorisne namjene (Darovi u novcu ili naravi do 2% od ukupnog prihoda prethodne godine za kulturu, znanost, odgoj i obrazovanje, zdravstvo, humanitarne, športske, vjerske, ekološke i dr. svrhe - čl. 7., st. 7. ZoPD)"
"4861","Darovanje za zdrav.potrebe (vanjskih osoba do 2% UPpr.god. a nije pokriveno osig.-čl.7.,st.8.ZoPD)","Darovanje za zdravstvene potrebe (darovanje vanjskih osoba do 2% od UP prethodne godine za operativne zahvate, liječenja, nabavu lijekova, ortopedskih pomagala i dr. što nije pokriveno osiguranjem - čl. 7., st. 8. ZoPD)"
"487","Darovanja iznad 2% od UP i dr. darovanja","Darovanja iznad 2% od UP i dr. darovanja"
"4870","Porezno nepriznata darovanja iznad 2% UP (iznad dop. s 486) i ino. udruga i sl. (čl.7.st.1.t.10 ZoPD)","Porezno nepriznata darovanja iznad 2% UP (za svrhe iznad dopuštenih s računa 486) i darovanja inozemnih udruga, ustanova i sl. (čl. 7. st. 1. t. 10. ZoPD)"
"4871","Darovi bez protučinidbe prim. i izdatci nisu u svezi s ostv.dobitka+PDV,osim na novac-čl7,st1.,t13ZoPD","Darovi (milodari), potpore i dotacije bez protučinidbe primatelja, te dr. izdatci koji nisu u svezi s ostvarivanjem dobitka (+PDV, osim na novac - čl. 7., st. 1., t. 13. ZoPD)"
"4872","Darovanje političkih stranaka i nezavisnih kandidata","Darovanje političkih stranaka i nezavisnih kandidata"
"488","Troškovi iz drugih aktivnosti (izvan osnovne djelatnosti)","Troškovi iz drugih aktivnosti (izvan osnovne djelatnosti)"
"4880","Troškovi iz ortačkog ugovora","Troškovi iz ortačkog ugovora"
"4881","Troškovi iz posredovanja","Troškovi iz posredovanja"
"489","Ostali troškovi - rashodi (čl. 7. ZoPD)","Ostali troškovi - rashodi (čl. 7. ZoPD)"
"4890","Rashodi utvrđeni u postupku nadzora (čl. 7. st. 1. t. 11. ZoPD) - skrivene isplate dobitka","Rashodi utvrđeni u postupku nadzora (čl. 7. st. 1. t. 11. ZoPD) - skrivene isplate dobitka - izuzimanje dioničara članova društva i fizičkih osoba (obrtnika) i s njima povez. osobama"
"4891","Troškovi -porezno nepriznati- koji nisu u svezi s ostvarivanjem dobitka(čl7, st1,t13.ZoPD-red.br.24PD) ","Troškovi koji nisu izravno u svezi s ostvarivanjem dobitka (čl. 7., st. 1., t. 13. ZoPD - red. br. 24 PD, npr. amortiz. imov. koja ne služi obavljanju djelatnosti, dodjela vlastitih dionica - udjela i dr.) - porezno nepriznati"
"4892","Troškovi povalstica i dr. oblici imovinskih koristi (čl. 7., st.1. t.10. ZoPD) - porezno nepriznati","Troškovi povalstica i dr. oblici imovinskih koristi (čl. 7., st.1. t.10. ZoPD) - porezno nepriznati"
"4899","Ostali nespomenuti poslovni rashodi","Ostali nespomenuti poslovni rashodi"
"49","RASPORED TROŠKOVA","RASPORED TROŠKOVA"
"490","Raspored troškova za obračun proiz. i usluga (HSFI10, MRS2, MRS11)-uskladištivi troškovi (na 60,62i63)","Raspored troškova za obračun proizvoda i usluga (prema HSFI 10 i MRS-u 2 i MRS-u 11) - uskladištivi troškovi (na račune 60, 62 i 63)"
"491","Raspored troškova za pokriće upravnih, administrativnih, prodajnih i drugih troškova (na rn 70 i 71)","Raspored troškova za pokriće upravnih, administrativnih, prodajnih i drugih troškova (na račune 70 i 71)"
"6","PROIZVODNJA, GOTOVI PROIZVODI, ROBA I DUGOTRAJNA IMOVINA NAMIJENJENA PRODAJI","PROIZVODNJA, GOTOVI PROIZVODI, ROBA I DUGOTRAJNA IMOVINA NAMIJENJENA PRODAJI"
"60","PROIZVODNJA - TROŠKOVI KONVERZIJE","PROIZVODNJA - TROŠKOVI KONVERZIJE"
"600","Proizvodnja u tijeku (po serijama, nositeljima, mjestima, radnim nalozima i sl.)","Proizvodnja u tijeku (razrada po serijama, nositeljima troškova, mjestima, pogonima, gradilištima, objektima, radnim nalozima i sl.)"
"601","Vrijednost usluga (u tijeku ili nedovršenih na datum bilance - MRS 2, t. 16.)","Vrijednost usluga (u tijeku ili nedovršenih na datum bilance - MRS 2, t. 16.)"
"602","Vanjska proizvodnja (kooperacija i dr.)","Vanjska proizvodnja (kooperacija i dr.)"
"605","Proizvodnja u slobodnoj zoni","Proizvodnja u slobodnoj zoni"
"606","Proizvodnja u doradi i manipulaciji","Proizvodnja u doradi i manipulaciji"
"607","Obustavljena proizvodnja","Obustavljena proizvodnja"
"608","Proizvodnja u tijeku iz ortačkog ugovora","Proizvodnja u tijeku iz ortačkog ugovora"
"609","Vrijednosno usklađivanje proizvodnje - usluga","Vrijednosno usklađivanje proizvodnje - usluga"
"61","NEDOVRŠENI PROIZVODI I POLUPROIZVODI","NEDOVRŠENI PROIZVODI I POLUPROIZVODI"
"610","Zalihe poluproizvoda (analitika prema osnovnim skupinama ili po stupnju dovršenosti)","Zalihe poluproizvoda (analitika prema osnovnim skupinama ili po stupnju dovršenosti)"
"611","Nedovršeni proizvodi i poluproizvodi (analitika po vrstama proizvoda)","Nedovršeni proizvodi i poluproizvodi (analitika po vrstama proizvoda)"
"619","Vrijednosno usklađivanje nedovršenih proizvoda i poluproizvoda","Vrijednosno usklađivanje nedovršenih proizvoda i poluproizvoda"
"62","BIOLOŠKA IMOVINA","BIOLOŠKA IMOVINA"
"620","Zalihe biološke proizvodnje u toku","Zalihe biološke proizvodnje u toku"
"621","Biloška imovina za prodaju","Biloška imovina za prodaju"
"629","Vrijednosno usklađivanje biloške imovine","Vrijednosno usklađivanje biloške imovine"
"63","ZALIHE GOTOVIH PROIZVODA","ZALIHE GOTOVIH PROIZVODA"
"630","Gotovi proizvodi na skladištu (razrada za svako skladište, pa po skupinama, tipovima, vrstama i sl.)","Gotovi proizvodi na skladištu (razrada za svako skladište a unutar toga po skupinama, tipovima, vrstama i sl.)"
"631","Gotovi proizvodi u javnom skladištu, silosu, i dr.","Gotovi proizvodi u javnom skladištu, silosu, i dr."
"632","Gotovi proizvodi dani u komisijsku prodaju","Gotovi proizvodi dani u komisijsku prodaju"
"633","Gotovi proizvodi dani u konsignacijsku prodaju","Gotovi proizvodi dani u konsignacijsku prodaju"
"634","Gotovi proizvodi u doradi, obradi i manipulaciji","Gotovi proizvodi u doradi, obradi i manipulaciji"
"635","Gotovi proizvodi u slobodnoj zoni","Gotovi proizvodi u slobodnoj zoni"
"636","Zalihe nekurentnih proizvoda i otpadaka","Zalihe nekurentnih proizvoda i otpadaka"
"637","Gotovi proizvodi u izložbenim prostorima","Gotovi proizvodi u izložbenim prostorima"
"638","Gotovi proizvodi iz ortaštava","Gotovi proizvodi iz ortaštava"
"639","Vrijednosno usklađivanje zaliha gotovih proizvoda","Vrijednosno usklađivanje zaliha gotovih proizvoda"
"64","GOTOVI PROIZVODI U VLASTITIM PRODAVAONICAMA","GOTOVI PROIZVODI U VLASTITIM PRODAVAONICAMA"
"640","Gotovi proizvodi u prodaji u vlastitim prodavaonicama (analitika po prodavaonicama)","Gotovi proizvodi u prodaji u vlastitim prodavaonicama (analitika po prodavaonicama)"
"641","Uračunani PDV u vrijednosti proizvoda","Uračunani PDV u vrijednosti proizvoda"
"642","Uračunani porez na luksuz","Uračunani porez na luksuz"
"648","Uračunana marža u prodajnoj cijeni gotovih proizvoda","Uračunana marža u prodajnoj cijeni gotovih proizvoda"
"649","Vrijednosno usklađivanje gotovih proizvoda u prodavaonicama","Vrijednosno usklađivanje gotovih proizvoda u prodavaonicama"
"65","OBRAČUN TROŠKOVA NABAVE ROBE - TROŠKOVI KUPNJE","OBRAČUN TROŠKOVA NABAVE ROBE - TROŠKOVI KUPNJE"
"650","Kupovna cijena robe od dobavljača","Kupovna cijena robe od dobavljača"
"651","Ostali troškovi nabave u svezi s dovođenjem robe na zalihu","Ostali troškovi nabave u svezi s dovođenjem robe na zalihu"
"6510","Troškovi transporta","Troškovi transporta"
"6511","Troškovi ukrcaja i iskrcaja (fakturirani)","Troškovi ukrcaja i iskrcaja (fakturirani)"
"6512","Transportno osiguranje","Transportno osiguranje"
"6513","Troškovi posebnog pakiranja - ambalaže","Troškovi posebnog pakiranja - ambalaže"
"6514","Troškovi vlastitog transporta (ne više od tarife javnog prijevoza) dovođenja robe na prodajnu lokaciju","Troškovi vlastitog transporta (ne više od tarife javnog prijevoza) dovođenja robe na prodajnu lokaciju"
"6515","Troškovi oblikovanja za posebne kupce","Troškovi oblikovanja za posebne kupce"
"6516","Troškovi čuvanja i rukovanja (u fazi nabave)","Troškovi čuvanja i rukovanja (u fazi nabave)"
"6517","Špediterski i bankarski troškovi","Špediterski i bankarski troškovi"
"6518","Nadoknada uvozniku za uslugu uvoza","Nadoknada uvozniku za uslugu uvoza"
"6519","Ostali troškovi kupnje (pregledi, atesti i troškovi u svezi s dovođenjem robe na zalihu -HSFI10 i MRS2)","Ostali troškovi kupnje (pregledi, atesti i dr. troškovi u svezi s dovođenjem robe na zalihu - HSFI 10 i MRS 2)"
"652","Carina i druge uvozne pristojbe za robu","Carina i druge uvozne pristojbe za robu"
"653","Posebni porezi (trošarine)","Posebni porezi (trošarine)"
"659","Obračun nabave - trošak kupnje","Obračun nabave - trošak kupnje"
"66","ROBA","ROBA"
"660","Roba u skladištu","Roba u skladištu"
"6600","Roba u vlastitom veleprodajnom skladištu (analitika po skladištima)","Roba u vlastitom veleprodajnom skladištu (analitika po skladištima)"
"6601","Zaliha otpadaka od robe","Zaliha otpadaka od robe"
"661","Roba u tuđem skladištu i izlozima","Roba u tuđem skladištu i izlozima"
"6610","Roba u tuđem skladištu","Roba u tuđem skladištu"
"6611","Roba u tuđim silosima, hladnjačama i sl.","Roba u tuđim silosima, hladnjačama i sl."
"6612","Roba u izložbenim prostorima","Roba u izložbenim prostorima"
"662","Roba dana u komisijsku ili konsignacijsku prodaju","Roba dana u komisijsku ili konsignacijsku prodaju"
"663","Roba u prodavaonicama","Roba u prodavaonicama"
"6630","Roba u prodavaonici (po prodajnoj cijeni -analitika po prodavaonicama), ili","Roba u prodavaonici (po prodajnoj cijeni -analitika po prodavaonicama), ili"
"66300","Roba u prodavaonici A s PDV-om 23%","Roba u prodavaonici A s PDV-om 23%"
"66301","Roba u prodavaonici A s PDV-om 10%","Roba u prodavaonici A s PDV-om 10%"
"66302","Roba u prodavaonici A s PDV-om 0%, itd.","Roba u prodavaonici A s PDV-om 0%, itd."
"664","Uračunani porezi u robi","Uračunani porezi u robi"
"6640","Uračunani PDV (analitika po prodajnim mjestima i poreznim stopama)","Uračunani PDV (analitika po prodajnim mjestima i poreznim stopama)"
"6641","Uračunani porez na luksuz","Uračunani porez na luksuz"
"665","Roba u carinskom skladištu ""D"" ili u slobodnoj zoni","Roba u carinskom skladištu ""D"" ili u slobodnoj zoni"
"6650","Vlastita roba u carinskom skladištu tipa ""D""","Vlastita roba u carinskom skladištu tipa ""D"""
"6651","Roba u slobodnoj zoni","Roba u slobodnoj zoni"
"666","Roba u doradi, obradi i manipulaciji","Roba u doradi, obradi i manipulaciji"
"6660","Vrijednost robe u doradi","Vrijednost robe u doradi"
"6661","Troškovi u svezi s doradom","Troškovi u svezi s doradom"
"667","Roba na putu","Roba na putu"
"668","Uračunana razlika u cijeni robe","Uračunana razlika u cijeni robe"
"6680","Razlika u cijeni robe na skladištu (analitički po skupinama robe s istom maržom)","Razlika u cijeni robe na skladištu (analitički po skupinama robe s istom maržom)"
"6681","Uračunana marža robe u prodavaonici","Uračunana marža robe u prodavaonici"
"669","Vrijednosno usklađivanje zaliha robe","Vrijednosno usklađivanje zaliha robe"
"6690","Vrijednosno usklađenje zbog pada cijena, smanjenja uporabljivosti i sl.","Vrijednosno usklađenje zbog pada cijena, smanjenja uporabljivosti i sl."
"6691","Prepravljene cijene robe zbog monetarnih oscilacija","Prepravljene cijene robe zbog monetarnih oscilacija"
"67","PREDUJMOVI ZA NABAVU ROBE","PREDUJMOVI ZA NABAVU ROBE"
"670","Dani predujmovi za nabavu robe","Dani predujmovi za nabavu robe"
"671","Dani predujmovi uvozniku za nabavu robe","Dani predujmovi uvozniku za nabavu robe"
"672","Dani predujmovi za robu povezanom društvu","Dani predujmovi za robu povezanom društvu"
"679","Vrijednosno usklađenje danih predujmova za robu","Vrijednosno usklađenje danih predujmova za robu"
"68","NEKRETNINE I UMJETNINE ZA TRGOVANJE","NEKRETNINE I UMJETNINE ZA TRGOVANJE"
"680","Nabavna vrijednost nekretnina za preprodaju (s porezom na promet)","Nabavna vrijednost nekretnina za preprodaju (s porezom na promet)"
"681","Troškovi dodatnog uređenja - dorade","Troškovi dodatnog uređenja - dorade"
"682","Umjetnine u prodaji","Umjetnine u prodaji"
"683","Nekretnine za prodaju (uređene)","Nekretnine za prodaju (uređene)"
"684","Uračunani PDV u umjetnine","Uračunani PDV u umjetnine"
"687","Predujmovi za kupnju nekretnina radi daljnje prodaje","Predujmovi za kupnju nekretnina radi daljnje prodaje"
"688","Uračunana razlika u cijeni nekretnina i umjetnina za daljnju prodaju","Uračunana razlika u cijeni nekretnina i umjetnina za daljnju prodaju"
"689","Vrijednosno usklađivanje nekretnina i umjetnina u prometu i predujmova","Vrijednosno usklađivanje nekretnina i umjetnina u prometu i predujmova"
"69","DUGOTRAJNA IMOVINA NAMIJENJENA PRODAJI","DUGOTRAJNA IMOVINA NAMIJENJENA PRODAJI"
"690","Nematerijalna imovina namijenjena prodaji","Nematerijalna imovina namijenjena prodaji"
"691","Materijalna imovina namijenjena za prodaju","Materijalna imovina namijenjena za prodaju"
"6910","Skupina imovine za prodaju (npr. pogon, poslov. jedinica i sl. )","Skupina imovine za prodaju (npr. pogon, poslov. jedinica i sl. )"
"699","Vrijednosno usklađenje dugotrajne imovine namijenjena prodaji","Vrijednosno usklađenje dugotrajne imovine namijenjena prodaji"
"7","POKRIĆE RASHODA I PRIHODI RAZDOBLJA","POKRIĆE RASHODA I PRIHODI RAZDOBLJA"
"70","TROŠKOVI PRODANIH ZALIHA PROIZVODA I USLUGA","TROŠKOVI PRODANIH ZALIHA PROIZVODA I USLUGA"
"700","Trošak zaliha prodanih proizvoda (60, 62, 63 i 64)","Trošak zaliha prodanih proizvoda (60, 62, 63 i 64)"
"701","Troškovi realiziranih usluga (490 i 601)","Troškovi realiziranih usluga (490 i 601)"
"702","Troškovi neiskorištenog kapaciteta (HSFI t. 10.18. i MRS 2 t. 13)","Troškovi neiskorištenog kapaciteta (HSFI t. 10.18. i MRS 2 t. 13)"
"703","Troškovi prodanih zaliha materijala i otpadaka (31, 32, 35 i 36)","Troškovi prodanih zaliha materijala i otpadaka (31, 32, 35 i 36)"
"7030","Troškovi nabavne vrijednosti materijala, dijelova, inventara i otpadaka","Troškovi nabavne vrijednosti materijala, dijelova, inventara i otpadaka"
"7031","Troškovi manjkova materijala, dijelova i inventara kojom se tereti odgovorna osoba","Troškovi manjkova materijala, dijelova i inventara kojom se tereti odgovorna osoba"
"704","Rashodi zaliha proizvodnje (HSFI 10 i MRS 2)","Rashodi zaliha proizvodnje (HSFI 10 i MRS 2)"
"7040","Dopušteni manjkovi -porezno priznati- tehnološki KRL i škart u proizvodnji (sa skupina 60, 62, 63 i 64)","Dopušteni manjkovi - tehnološki kalo, rastep, kvar i lom i škart u proizvodnji (sa skupina 60, 62, 63 i 64) - porezno priznati"
"7041","Prekomjerni manjkovi-porezno priznati teh.KRL i škart u proiz.(60,62,63i64 -HSFI t10.21. i MRS2,t14)","Prekomjerni manjkovi - tehnološki kalo, rastep, kvar, lom i škart u proizvodnji (60, 62, 63 i 64 - HSFI t. 10.21. i MRS 2, t. 14.) a porezno dopušteni po očevidu i sl. - porezno priznati"
"7042","Prekomjerni manjkovi proizvoda (HSFI t. 10.2. i MRS 2, t. 16.) - porezno nepriznati","Prekomjerni manjkovi proizvoda (HSFI t. 10.2. i MRS 2, t. 16.) - porezno nepriznati"
"7043","Razlika višeg troška proizvodnje od neto-vrij. koja se može realizirati (HSFIt.10.35. i MRS2t.28.-33.)","Razlika višeg troška proizvodnje od neto-vrijednosti koja se može realizirati (HSFI t. 10.35. i MRS 2, t. 28. do 33.)"
"7044","Troškovi isporučenih proizvoda u jamstvenom roku (zamjena)","Troškovi isporučenih proizvoda u jamstvenom roku (zamjena)"
"705","Greškom neiskazani rashodi proteklih razdoblja","Greškom neiskazani rashodi proteklih razdoblja"
"706","Gubitci iz ugovora o izgradnj (MRS 11, t. 36.)","Gubitci iz ugovora o izgradnj (MRS 11, t. 36.)"
"707","Troškovi iz ugovora o ortaštvu","Troškovi iz ugovora o ortaštvu"
"708","Troškovi vrijed. uskl. proizvod. u tijeku(609), poluproizvoda(629) i zaliha got. proizvoda (639 i 649)","Troškovi vrijednosnog usklađenja proizvodnje u tijeku (609), poluproizvoda (629) i zaliha gotovih proizvoda (639 i 649)"
"71","TROŠKOVI PRODANE ROBE","TROŠKOVI PRODANE ROBE"
"710","Nabavna vrijednost prodane robe","Nabavna vrijednost prodane robe"
"7100","Trošak prodane robe u tuzemstvu","Trošak prodane robe u tuzemstvu"
"7101","Trošak prodane robe u inozemstvu","Trošak prodane robe u inozemstvu"
"7102","Troškovi prodane robe u tranzitu","Troškovi prodane robe u tranzitu"
"7103","Trošak prodane robe u poslov. jed.","Trošak prodane robe u poslov. jed."
"711","Nabavna vrijednost prodanih nekretnina i umjetnina","Nabavna vrijednost prodanih nekretnina i umjetnina"
"712","Troškovi dugotr. imov. namijenjeni prodaji","Troškovi dugotr. imov. namijenjeni prodaji"
"713","Troškovi kala, rastepa, kvara i loma na robi i otpisi robe","Troškovi kala, rastepa, kvara i loma na robi i otpisi robe"
"7130","Kalo, rastep, kvar i lom u dopuštenoj visini prema Pravilniku HGK - porezno priznati","Kalo, rastep, kvar i lom u dopuštenoj visini prema Pravilniku HGK - porezno priznati"
"7131","Manjkovi uslijed više sile (provalne krađe, poplava, požar, potres i sl.) - porezno priznati","Manjkovi uslijed više sile (provalne krađe, poplava, požar, potres i sl.) - porezno priznati"
"7132","Manjkovi i otpisi trgovačke robe po očevidu PU i sl. - porezno priznati","Manjkovi i otpisi trgovačke robe po očevidu PU i sl. - porezno priznati"
"7133","Prekomjerni kalo, rastep, kvar i lom + PDV - porezno nepriznati","Prekomjerni kalo, rastep, kvar i lom + PDV - porezno nepriznati"
"7134","Manjak robe na teret odgovorne osobe","Manjak robe na teret odgovorne osobe"
"714","Troškovi zamjene robe u jamstvenom roku","Troškovi zamjene robe u jamstvenom roku"
"715","Greškom neiskazani rashodi prodane robe u proteklim razdobljima u trgovini","Greškom neiskazani rashodi prodane robe u proteklim razdobljima u trgovini"
"718","Troškovi vrijednosnog usklađenja trgovačke robe i predujmova (669, 679, 689)","Troškovi vrijednosnog usklađenja trgovačke robe i predujmova (669, 679, 689)"
"719","Troškovi vrijednosnog usklađenja dugotrajne imovine namijenjene prodaji (699)","Troškovi vrijednosnog usklađenja dugotrajne imovine namijenjene prodaji (699)"
"72","TROŠKOVI ADMINISTRACIJE I OSTALI RASHODI","TROŠKOVI ADMINISTRACIJE I OSTALI RASHODI"
"720","Troškovi uprave, prodaje, administracije (491)","Troškovi uprave, prodaje, administracije (491)"
"721","Ostali poslovni rashodi - nespomenuti","Ostali poslovni rashodi - nespomenuti"
"73","IZVANREDNI - OSTALI RASHODI","IZVANREDNI - OSTALI RASHODI"
"730","Izvanredni rashodi od prodaje dugotrajne imovine (HSFI t. 8.35.)","Izvanredni rashodi od prodaje dugotrajne imovine (HSFI t. 8.35.)"
"731","Izvanredni otpisi od otuđenja imovine, nastali neočekivano i u visokoj vrijednosti (HSFt4.7. i MRS10t9)","Izvanredni otpisi od otuđenja imovine koji su nastali neočekivano i u visokoj vrijednosti (HSFI t. 4.7. i MRS 10. t. 9.)"
"732","Gubitci zbog izvlaštenja ili zbog prirodnih katastrofa na važnom dijelu imovine","Gubitci zbog izvlaštenja ili zbog prirodnih katastrofa na važnom dijelu imovine"
"733","Izvanredni rashodi iz ostalih rijetkih i neobičnih događaja ili transakcija","Izvanredni rashodi iz ostalih rijetkih i neobičnih događaja ili transakcija"
"734","Izvanredne kazne, penali, odštete, naknadno utvrđ. obveze i sl.","Izvanredne kazne, penali, odštete, naknadno utvrđ. obveze i sl."
"735","Nerealizirani gubitci","Nerealizirani gubitci"
"737","Gubitci od procjene biološke imovine","Gubitci od procjene biološke imovine"
"74","UDIO U GUBITKU I DOBITKU PRIDRUŽENIH PODUZETNIKA","UDIO U GUBITKU I DOBITKU PRIDRUŽENIH PODUZETNIKA"
"740","Udio u gubitku pridruženih poduzetnika","Udio u gubitku pridruženih poduzetnika"
"7400","Udio u gubitku povezanih društava","Udio u gubitku povezanih društava"
"7401","Udio u gubitku ortaka","Udio u gubitku ortaka"
"745","Udio u dobitku od pridruženih poduzetnika","Udio u dobitku od pridruženih poduzetnika"
"7450","Udio u dobitku povezanih društava","Udio u dobitku povezanih društava"
"7451","Udio u dobitku ortaštva","Udio u dobitku ortaštva"
"75","PRIHODI OD PRODAJE PROIZVODA I USLUGA","PRIHODI OD PRODAJE PROIZVODA I USLUGA"
"750","Prihodi od prodaje proizvoda (analitika po proizvodima ili profitnim centrima)","Prihodi od prodaje proizvoda (analitika po proizvodima ili profitnim centrima)"
"7500","Prihodi od prodaje proizvoda od redovne prodaje","Prihodi od prodaje proizvoda od redovne prodaje"
"7501","Prihodi od prodaje proizvoda na kredit ili otplatu","Prihodi od prodaje proizvoda na kredit ili otplatu"
"7502","Prihodi ostvareni u slobodnoj zoni","Prihodi ostvareni u slobodnoj zoni"
"7503","Prodaja u vlastitim prodavaonicama","Prodaja u vlastitim prodavaonicama"
"7504","Prihodi od prodaje stanova i dr. građevina","Prihodi od prodaje stanova i dr. građevina"
"7505","Prihodi od prodaje poluproizvoda i nedovršenih proizvoda","Prihodi od prodaje poluproizvoda i nedovršenih proizvoda"
